web-scraper-order,web-scraper-start-url,tiltle,date,Sourse,link,link-href,key_words,whole_text,first_source,first_source-href,second_sourse,second_sourse-href,third_source,third_source-href,,,,,
1625022283-95,https://www.politifact.com/factchecks/list/?page=1&category=coronavirus&ruling=mostly-true,There’s a “direct correlation” between North Carolina’s mask requirement and COVID-19 stabilization.,"stated on July 28, 2020 in a press conference:",Mandy Cohen,There’s a “direct correlation” between North Carolina’s mask requirement and COVID-19 stabilization.,https://www.politifact.com/factchecks/2020/aug/05/mandy-cohen/there-correlation-between-north-carolinas-mask-law/,"North Carolina




Coronavirus







Mandy Cohen","Is there a correlation between North Carolina's mask law and its coronavirus cases?




If Your Time is short




Mandy Cohen, Secretary of North Carolina's Department of Health and Human Services, says there’s a “direct correlation” between NC’s mask law and COVID-19 stabilization in late July.
North Carolina's stats show that the number of new coronavirus cases started to dip about three weeks after the mask mandate.
It's fair to say there's a correlation, experts told us. But there's not enough evidence to say the two are linked.




See the sources for this fact-check




North Carolina’s top health official says there’s evidence that a statewide mask requirement is helping stabilize coronavirus cases in the state.
In a press conference on July 28, Health Secretary Mandy Cohen said:
""Our actions to slow the spread of this virus are having an impact. Specifically, we see a direct correlation to the start of the statewide mask requirement at the end of June. Two to three weeks after implementing this requirement, we started to see the beginning of these more stable trends.""
Is it true that there’s a ""direct correlation"" between North Carolina’s mask requirement and COVID-19 stabilization?
Data shows that the number of new reported COVID-19 cases is beginning to stabilize. Experts told PolitiFact the mask law and case count could be related, but that it’s hard to quantify the law’s impact.
Cases leveling
Gov. Roy Cooper announced the mask requirement on June 24 and it went into effect on June 26.
Cohen said North Carolina’s case count started to level about three weeks later. Why is Cohen judging the rule’s effectiveness three weeks after its implementation, rather than immediately after its implementation?
It can take up to 14 days between the time someone was infected and the time they start showing symptoms, according to the U.S. Centers for Disease Control and Prevention. That means someone could have contracted the virus before the mask mandate, but not shown symptoms or tested positive until after the mask requirement was in effect.
So let’s look at North Carolina’s case counts.

One way experts measure coronavirus trends is by calculating the 7-day rolling average for the number of new cases or deaths per day. The N.C. Department of Health and Human Services (DHHS) and WRAL both track this metric.
The average number of new cases per day rose until about July 18, when DHHS reported 2,481 cases. The daily count started to drop after that date, and the rolling 7-day average has been less than 2,000 cases ever since.
What experts said
So Cohen is right that the number of new cases is stabilizing. Is that a direct result of the mandate?
There’s evidence that widespread mask-wearing has helped reduce the spread of the novel coronavirus, as we’ve previously reported. 
We spoke with experts at the University of North Carolina, Harvard University, the University of Nebraska and the University of Toronto.

Featured Fact-check
















Viral image


stated on June 1, 2021 in a Facebook post








“U.S. military arrests Dr. Deborah Birx.”












By Ciara O'Rourke • June 2, 2021







While they agreed that there may be a correlation, they say there’s not enough evidence yet to determine how much influence the mask rule had on the stabilization.
Other factors -- such as social distancing or testing availability -- could also play a role.
But reviewing that data typically takes months, said Ryan McNamara, a research associate in UNC’s Department of Microbiology and Immunology. 
""There's just a lot of variables at play that need to be accounted for,"" he said.
There’s a popular saying in research: ""correlation does not mean causation."" In this context, it means that the mask law may not have caused the dip in new COVID-19 cases, even though there are signs a cause-and-effect relationship could exist.
""That said, Dr. Cohen and her team are in possession of much more data than I am. I think her statement was carefully worded and has scientific merit.""
Ali Khan, dean of the College of Public Health and professor of epidemiology at the University of Nebraska Medical Center, agreed that it’s premature to directly credit the mask rule for the leveling-off of cases. 
But he believes Cohen’s claim is fair, given that ""other data that (shows) masks work and accounting for numerous caveats such as what else happened 2-3 weeks ago.""
Dr. Barry Bloom, a research professor of public health at Harvard University, said it’s ""difficult to disaggregate a single intervention from the other standard public health behaviors.""
However, Bloom said it’s possible that the mask requirement not only prompted more people to wear masks -- but to start taking other precautionary measures as well.
""I think it is safe to say they may have contributed to the more stable trends, assuming the trends are indeed stable for a couple of weeks,"" Bloom said. 
As of August 3, the state’s rolling 7-day average remained below 2,000 cases and was still declining.
Our ruling
Cohen said there’s a ""direct correlation"" between North Carolina’s mask requirement and COVID-19 stabilization.
Based on the data available in late July, experts said there does appear to be a correlation, but it’s too early to draw conclusions about it. Verifying the strength of the correlation can take months.
The statement is accurate but needs clarification or additional information. We rate it Mostly True.",null,,null,,count of coronavirus cases,https://covid19.ncdhhs.gov/dashboard/cases,,,,,
1625022372-101,https://www.politifact.com/factchecks/list/?page=1&category=coronavirus&ruling=mostly-true,“More cops have died from COVID this year than have been killed on patrol.”,"stated on August 31, 2020 in a speech in Pittsburgh:",Joe Biden,“More cops have died from COVID this year than have been killed on patrol.”,https://www.politifact.com/factchecks/2020/sep/02/joe-biden/has-covid-19-killed-more-cops-all-other-causes/,"National




Public Safety




Coronavirus







Joe Biden","Has COVID-19 killed more cops than all other causes?




If Your Time is short





Two separate groups find that more law enforcement officers died from COVID-19 than all other causes, including gunfire and car accidents.


Corrections officers are included in the tally.





See the sources for this fact-check




At the Republican National Convention, President Donald Trump cast himself as a stalwart friend of police and an effective leader in the fight against COVID-19.
In a speech in Pittsburgh, Democratic nominee Joe Biden said Trump was neither.
""Do you feel safer under Donald Trump?"" Biden asked Aug. 31. ""More cops have died from COVID this year than have been killed on patrol.""
That stat raised eyebrows, and we checked to see if it was true. Biden didn’t say exactly what the best data show, but the comparison is largely accurate.
Tallies of deaths by two national groups show that COVID-19 has killed more law enforcement officers than gunfire and other hazards of the job in 2020. The caveat to Biden’s claim is there is some statistical fuzziness regarding who is a cop and what it means to be on patrol. 
Roughly one-third of these tallies include corrections and detention center officers who work inside institutions where the virus can spread more readily. Some Customs and Border Protection field officers and other first responders are also included. While these occupations are counted as part of law enforcement, they might not come to mind as the cops that Biden referred to. 
The COVID-19 death toll is still the greatest single cause of death when those occupations are excluded.
What the broad numbers show
The National Law Enforcement Officer Memorial Fund lists 101 dead officers from COVID-19 compared with 87 from anything else, including gunfire, car accidents or other causes. If it weren’t for COVID-19, officer deaths were on track to be lower this year than last.
The National Law Enforcement Officer Memorial Fund says on its website that before it adds an officer to its list of deaths due to the virus, ""substantive evidence will be required to show the death was more than likely due to the direct and proximate result of"" exposure in the line of duty.
Another source, the Officer Down Memorial Page, shows 101 deaths from COVID-19 and 81 deaths from all other causes. Communications director Jessica Rushing said the count is updated daily.

Featured Fact-check
















Facebook posts


stated on June 2, 2021 in a Facebook post








Emails show ""Fauci's fellow scientist could tell early on that the (coronavirus) looked manufactured.""












By Jon Greenberg • June 2, 2021







(The Fraternal Order of Police has tracked 208 deaths from COVID-19, but not fatalities from other causes. It notes that it doesn’t verify the COVID-19 deaths.)

According to Rushing’s group, gunfire is the second most common cause of death. 

By a factor of three, COVID-19 is the leading cause of death for the broad group of officers.
That has as much to do with the pattern of police fatalities as it does with the virus, said Rutgers criminologist Frank Edwards. Deaths in the line of duty due to any cause tend to average about eight each month. 
FBI data on deaths in the line of duty further back this point. The FBI numbers distinguish between accidental and felonious deaths of officers in the community. They show that in a typical month, criminal acts kill less than five officers a month.
Excluding the corrections and detention officers, the toll from COVID-19 remains at about 70 in the Officer Down count — still double the loss of life due to gunfire, but not higher than the sum of other causes of death.
Our ruling
Biden said that more cops have died from COVID-19 than while on patrol.
COVID-19 by itself has killed more law enforcement officers than all other causes combined, according to two groups that track these numbers.
No matter how we parsed the data — by excluding correctional and detention center officers, or by focusing on felonious deaths to officers that could be considered ""on patrol"" — COVID-19 posed the greatest single threat to officers’ lives.
We rate this claim Mostly True.",Joe Biden Delivers Remarks on Public Safety and Law Enforcement,https://www.c-span.org/video/?475311-1/joe-biden-delivers-remarks-public-safety-law-enforcement,Fallen Officers From the COVID-19 Pandemic,https://www.odmp.org/search/incident/covid-19,asked Aug. 31,https://www.c-span.org/video/?475311-1/joe-biden-delivers-remarks-public-safety-law-enforcement,,,,,
1625022612-118,https://www.politifact.com/factchecks/list/?page=1&category=coronavirus&ruling=mostly-true,“Senate Democrats just voted to give stimulus checks to criminals in prison.”,"stated on March 6, 2021 in a tweet:",Tom Cotton,“Senate Democrats just voted to give stimulus checks to criminals in prison.”,https://www.politifact.com/factchecks/2021/mar/09/tom-cotton/yes-democrats-voted-send-stimulus-checks-prisoners/,"National




Criminal Justice




Stimulus




Coronavirus







Tom Cotton","Yes, Democrats voted to send stimulus checks to prisoners, as Republicans did last year




If Your Time is short





Democrats rejected a Republican amendment that would have barred prisoners from receiving $1,400 stimulus checks.


Democrats said the plan would hurt the families of prisoners, making it harder for them to pay their monthly bills.


Both parties supported past stimulus bills that sent checks to prisoners.





See the sources for this fact-check




In the long hours of debate before Senate Democrats passed their sweeping COVID-19 relief package, Republicans offered amendments designed to put Democrats on record on very particular policy points.
Sens. Tom Cotton, R-Ark., and Bill Cassidy, R-La., put forward one that would prevent $1,400 stimulus checks from going to prisoners. The amendment failed on a party-line vote.
Cotton tweeted that this was another example of spending tucked in the bill that had nothing to do with pandemic.
""Senate Democrats just voted to give stimulus checks to criminals in prison,"" he tweeted March 6. ""They haven’t lost their jobs, they aren’t worried about paying rent or buying groceries.""
 
Cotton repeated his point March 8 on Fox News, saying ""every single Democrat"" wanted to send checks to prisoners — invoking Boston Marathon bomber Dzhokhar Tsarnaev and Charleston, S.C., church shooter Dylann Roof.
The record shows that Democrats rejected the amendment to prevent payments to prisoners.
Sen. Dick Durbin, D-Ill., said it would harm prisoners’ families.
""Given the stark racial disparities in our criminal justice system, this would cause the most harm to Black and brown families and communities already harmed by mass incarceration,"" Durbin said on the Senate floor. ""Children should not be forced to go hungry because a parent is incarcerated.""
Prisoners qualify for stimulus payments because of broad eligibility requirements in this relief bill — and others. Prisoners must be a citizen or legal resident, and either need to have filed a tax return, possibly as part of a joint filing, or complete an Internal Revenue Service form requesting payment. 
It’s worth noting that the two previous rounds of stimulus checks during the Trump administration — in the CARES Act in March, and the supplemental package in December — allowed prisoners to receive checks, too.

Featured Fact-check
















Facebook posts


stated on June 2, 2021 in a Facebook post








Emails show ""Fauci's fellow scientist could tell early on that the (coronavirus) looked manufactured.""












By Jon Greenberg • June 2, 2021







Cotton voted for both of those bills.
His press secretary James Arnold said circumstances were different. In the CARES Act, the issue was ""an unanticipated problem,"" and in December, there was no opportunity to amend the bill.
The issue had come up before.
In 2009, President Barack Obama’s economic recovery package barred stimulus checks for most prisoners. Only a few thousand got them, through an exception in the law for those who had just gone to jail.
In 2020, Washington put a priority on getting checks to people as quickly as possible. The CARES Act kept the eligibility rules broad and simple. Basically, anyone who was an American citizen or permanent legal resident, wasn’t claimed as a dependent by someone else, and had filed a tax return (or didn’t need to because they made very little), could get a check.
With the December bill, Republicans could have added a prisoner ban to the legislation before it came to an up-or-down vote.
The issue of prisoners and stimulus checks had long been in the news. Earlier in the year, the IRS blocked CARES Act payments to prisoners. That prompted a class action lawsuit on behalf of incarcerated people, arguing that the IRS rule was arbitrary and unlawful.
In October, a federal judge ruled against the IRS and said the government had to issue the checks. The judge ruled that the CARES Act had no language restricting payments to prisoners, and the administration couldn’t invent one. That only applied to the CARES Act, but the point is, Republicans had ample opportunity to grapple with the issue as the December bill was being written.
Despite having the right to stimulus checks, many prisoners hit a stumbling block: The IRS sent the inmates debit cards that some states couldn’t process. 
Our ruling
Cotton said Democrats voted to give stimulus checks to people in prison.
They did, arguing that to do otherwise would harm the families of prisoners. It’s worth noting that Cotton and other Senate Republicans voted for previous relief packages that also resulted in prisoners getting checks. 
With that clarification, we rate this claim Mostly True.",tweet,https://twitter.com/SenTomCotton/status/1368223839990280199,Senate debate: American Rescue Plan Act,https://www.congress.gov/congressional-record/2021/03/05/senate-section/article/S1219-2,"Stimulus, round 2: Incarcerated people will be eligible for new round of payments",https://www.prisonpolicy.org/blog/2020/12/30/stimulus-round-2/,,,,,
1625022243-92,https://www.politifact.com/factchecks/list/?page=1&category=coronavirus&ruling=mostly-true,"Say Wisconsin Republican lawmakers have done nothing ""while neighboring states like Minnesota, Illinois and Michigan have already implemented safety precautions like requiring individuals to wear masks.""","stated on July 24, 2020 in a news release:",Wisconsin state Senate Democrats,"Say Wisconsin Republican lawmakers have done nothing ""while neighboring states like Minnesota, Illinois and Michigan have already implemented safety precautions like requiring individuals to wear masks.""",https://www.politifact.com/factchecks/2020/jul/31/wisconsin-state-senate-democrats/wisconsin-democrats-say-lawmakers-neighboring-stat/,"Public Health




States




Wisconsin




Coronavirus







Wisconsin state Senate Democrats","Wisconsin Democrats say lawmakers in neighboring states have done more on COVID-19 than state GOP




If Your Time is short





Lawmakers in Minnesota, Michigan and Illinois have passed more COVID-19 legislation than Wisconsin’s GOP-controlled legislature.


That said, some safety precautions in those states came about through executive orders by the governors.





See the sources for this fact-check




Wisconsin’s response to the coronavirus outbreak is under a microscope as cases surge and Republicans and Democrats continue to clash over what -- if anything -- to do about the increase.
Tensions boiled over July 30, 2020 after Democratic Gov. Tony Evers issued a statewide face mask mandate, despite opposition from Republicans who contend the move amounts to government overreach. 
In the days before that, though, the state Senate’s Democratic Committee turned its frustration toward Republican lawmakers.
""While neighboring states like Minnesota, Illinois and Michigan have already implemented safety precautions like requiring individuals to wear masks, similar pleas in Wisconsin have fallen on deaf ears of Republican legislators,"" stated a July 24 news release.
Lawmakers in those states have passed more COVID-19-related bills than Wisconsin’s Republican-controlled Legislature since the pandemic began. But some precautions, like a mask mandate, came from executive orders and not legislation. 
How does the committee’s claim stack up?
What Wisconsin has done (or not) 
Eric LaGesse, executive director of the Senate’s Democratic committee, did not respond to PolitiFact Wisconsin’s request for evidence to back up their claim. But the claim is pretty straightforward, and there has been a lot of news coverage of the state’s response to the pandemic. Here’s a recap:
In March, Evers and Health Services Secretary Andrea Palm issued a series of orders to curb large gatherings as COVID-19 began to emerge in Wisconsin. Those actions culminated in a stay-at-home order on March 24, 2020, which shut down the state to help contain the virus’ spread.
In April, lawmakers passed a coronavirus relief package that allowed the state to tap into extra federal Medicaid dollars and suspended a one-week waiting period for collecting unemployment benefits, among other provisions. However, the state lost $25 million in federal funding for unemployment because Republican leaders waited too long to schedule a floor session on the relief package. 
Evers’ administration extended the stay-at-home order on April 16 and four days later unveiled the Badger Bounce Back plan, which provided a phased approach for reopening based on testing and other public health criteria. In May, acting on a lawsuit from state GOP leaders, the state Supreme Court struck down much of the order and allowed the state to reopen without any protocols in place.

Featured Fact-check
















Instagram posts


stated on June 2, 2021 in an Instagram post








An email from Dr. Anthony Fauci shows ""everyone was lied to"" about wearing masks to prevent the spread of COVID-19.












By Tom Kertscher • June 2, 2021







After that, not much happened at the state level until the mask mandate despite a recent surge in infections and multiple daily increases of over 1,000 cases.
Lawmakers have introduced 10 bills related to the pandemic in recent months, the Milwaukee Journal Sentinel reported. The relief package we mentioned earlier is the only one that’s passed.
What about our neighbors?
The Democratic committee argued neighboring states -- specifically Illinois, Minnesota and Michigan -- have implemented more safety precautions for their residents.
According to a database maintained by the National Conference of State Legislatures, Minnesota enacted 25 pieces of legislation related to COVID-19 through July 23 after lawmakers introduced over 200 measures. Illinois has passed 18, and Michigan approved 19. The bills touch on a wide range of issues, from COVID-19 testing to election procedures.
The differences between Wisconsin and its neighbors can’t be blamed on partisan gridlock, either. While Democrats control Illinois’ state government, Minnesota’s legislature is split between both parties with a Democrat in the governor’s office. Michigan, like Wisconsin, has a Democratic governor and a Republican-controlled legislature. 
It’s worth noting, though, that some of the precautions in other states came about through executive orders by their governors, not action by the legislature. Illinois Gov. J.B. Pritzer, for example, issued an order on June 26 requiring residents to wear face coverings -- over a month before Evers enacted a mask mandate in Wisconsin. 
Governors in other states also enacted stay-at-home orders similar to what Evers implemented.
Our ruling
Wisconsin’s state Senate Democratic Committee claimed Republican lawmakers have failed to act while ""neighboring states like Minnesota, Illinois and Michigan have already implemented safety precautions like requiring individuals to wear masks.""
It’s clear that Wisconsin lawmakers are behind the curve on COVID-19 compared to neighboring legislatures. Legislative bodies in Minnesota, Illinois and Michigan have introduced and passed more bills since the pandemic began. 
But they didn’t act alone, and safety precautions like mask mandates were ordered by their governors. 
That leaves us with a statement that’s accurate but needs clarification or additional information.
We rate this claim Mostly True.",executive orders,https://evers.wi.gov/Pages/Newsroom/Executive-Orders.aspx,null,,null,,,,,,
