web-scraper-order,web-scraper-start-url,tiltle,date,Sourse,link,link-href,key_words,whole_text,first_source,first_source-href,second_sourse,second_sourse-href,third_source,third_source-href,,,,,
1625020797-12,https://www.politifact.com/factchecks/list/?page=2&category=coronavirus&ruling=true,"Says of the coronavirus threat, “there was not a single suggestion by anyone, a doctor, a scientist, a political figure, that we needed to cancel Mardi Gras.”","stated on April 5, 2020 in a CNN interview:",John Bel Edwards,"Says of the coronavirus threat, “there was not a single suggestion by anyone, a doctor, a scientist, a political figure, that we needed to cancel Mardi Gras.”",https://www.politifact.com/factchecks/2020/apr/08/john-bel-edwards/louisiana-governor-right-there-was-no-suggestion-m/,"Public Health




Public Safety




Coronavirus







John Bel Edwards","Louisiana governor is right, there was no suggestion Mardi Gras had to be canceled




If Your Time is short





The Carnival season in New Orleans kicked off early January and ended Feb. 25.


There were few coronavirus cases in the United States at the time, and health officials then said there was no community spread.


The earliest indication we found from a federal agency saying that large events may need to be canceled came Feb. 26, after Mardi Gras celebrations. 





See the sources for this fact-check




Louisiana Gov. John Bel Edwards on CNN was asked whether Mardi Gras celebrations in his state should have been called off earlier this year, in light of Louisiana now being considered a hotspot in the coronavirus pandemic.
In New Orleans, the Carnival parades and celebrations started early January and ended Feb. 25 on Mardi Gras (Fat Tuesday). It’s estimated that more than 1 million people go to New Orleans annually for the Carnival season and experts now believe the festivities fueled the outbreak.
""The biggest Mardi Gras parades in Louisiana took place on Feb. 25, just as the national outbreak was starting. In retrospect, if you knew then what you know now, would you have canceled Mardi Gras?"" CNN’s Jake Tapper asked Edwards on April 5.
""Well, you know you don't get a do-over like that, Jake,"" Edwards said. ""There was not a single suggestion by anyone, a doctor, a scientist, a political figure, that we needed to cancel Mardi Gras. And, you know, in February, we had a Super Bowl, and it wasn't canceled and so forth.""
Edwards’ comments echoed a similar statement from New Orleans Mayor LaToya Cantrell 10 days earlier on CNN that there were ""no red flags"" from federal officials to suggest the festivities should be aborted.
PolitiFact wondered if it’s true that there were no suggestions back in January or February that mass gatherings like Mardi Gras be canceled.
We reviewed statements from President Donald Trump, and guidance from federal and state public health agencies and found that Edwards was right. Public health professors in Louisiana also told PolitiFact that there was no suggestion, prior to Mardi Gras, of community spread in the United States, much less New Orleans.
The earliest suggestion we found from a federal agency saying that large events may need to be canceled came Feb. 26, after Mardi Gras celebrations.
Messaging from Trump
On Twitter and in public remarks, Trump did not suggest that large public events be canceled. In India on Feb. 25 and before leaving for India on Feb. 23, Trump said the coronavirus was very ""under control"" in the United States.
Trump tweeted about the virus at least eight times from January to Feb. 25.
His tweets generally said that his administration was in contact with China and others about the coronavirus, offered praise for Chinese President Xi Jinping’s handling of the outbreak, and said that his administration was monitoring developments and had it under control.
On Lundi Gras, the day before Mardi Gras, he tweeted: 
The Coronavirus is very much under control in the USA. We are in contact with everyone and all relevant countries. CDC & World Health have been working hard and very smart. Stock Market starting to look very good to me!— Donald J. Trump (@realDonaldTrump) February 24, 2020 
 
Messaging from public health agencies
When the U.S. declared the coronavirus a public health emergency on Jan. 31, the government did not say that mass gatherings be canceled.

Featured Fact-check
















Instagram posts


stated on June 2, 2021 in an Instagram post








An email from Dr. Anthony Fauci shows ""everyone was lied to"" about wearing masks to prevent the spread of COVID-19.












By Tom Kertscher • June 2, 2021







Throughout January and most of February, U.S. officials said that the coronavirus risk to the American public was low and that they were not seeing community spread of the virus. By Feb. 25, there were 53 confirmed COVID-19 cases in the United States and no deaths, according to data compiled by the World Health Organization.
On Feb. 26, the day after Mardi Gras, a Centers for Disease Control and Prevention doctor told reporters that the coronavirus situation was rapidly evolving and that the virus was spreading worldwide.
There were still only a few cases in the United States and no reports of community spread, but that would eventually change, said Nancy Messonnier, director of the CDC’s National Center for Immunization and Respiratory Diseases. She said there were mitigation guidelines that people and communities could take during a pandemic when there wasn’t a vaccine or proven medical treatment for the disease.
""On a larger scale, communities and cities may need to modify, postpone, or cancel mass gatherings,"" Messonnier said. Local communities would need to figure out which guidelines to implement and when, she said, based on the severity and the transmission of the disease and what could be done locally.
On Feb. 28, Messonnier said it was possible that a reported case in California ""could be the first instance of community spread — meaning the illness was acquired through an unknown exposure in the community."" But it could also be that the patient was exposed through contact to a traveler who was infected, Messonnier said. The immediate risk to the general American public remained low, she said.
On Feb. 29, a health official from Washington state, where there were four presumptive cases of COVID-19, joined a CDC press briefing and said the state was ""starting to see some spread in the community"" and the public risk was increasing. ""Should we start to see more spread in Washington, we might consider recommending measures like cancelling large public events,"" said Kathy Lofy, the state health officer at the Washington state department of health.
There were no reported cases of coronavirus in Louisiana during the weeks-long Carnival celebrations. The state’s department of health in blog posts as late as Feb. 21 said that the coronavirus threat to Louisiana was very low and that people should be more worried about the flu. It recommended that people wash their hands and get a flu shot, since it was still flu season.
Louisiana’s first presumptive case of coronavirus was reported March 9, two days before the World Health Organization declared the new coronavirus a pandemic. On March 13, when Louisiana had 33 presumptive positive cases of COVID-19, Edwards signed a proclamation to stop gatherings of more than 250 people and close all K-12 public schools statewide to slow the spread of the disease.
Based on models created mid-March, it’s assumed that infections silently spread in crowded parades during Mardi Gras, said Susanne Straif-Bourgeois, an associate professor of epidemiology at Louisiana State University Health Sciences Center New Orleans. Soon after Mardi Gras, epidemiologists from nearby states began reporting confirmed cases of coronavirus in people who had traveled to New Orleans for the festivities. But at the time that parade-goers gathered in streets with family and friends, it was not known that the virus was in the state, Straif-Bourgeois said.
In his CNN interview with Edwards, Tapper said the Washington Post reported that governors had a gala in Washington, D.C. in early February, and that a group of governors met with federal experts who gave ""the same dire warning that they’re giving now.""
Maryland Gov. Larry Hogan told the Washington Post, ""The doctors and the scientists, they were telling us then exactly what they are saying now.""
Edwards told Tapper that in that Feb. 9 briefing, ""we spoke generally about the novel coronavirus"" and that it was ""not accurate to say that they gave the same sort of information that they are providing right now,"" since a lot more is now known about the virus.
Edwards’ deputy chief of staff, Christina Stephens, told PolitiFact that at that briefing, the virus was described as low risk and there was no suggestion that large gatherings be canceled.
In a Feb. 9 press release about the briefing, the U.S. Health and Human Services department said the task force ""reiterated that while this is a serious public health matter, the risk to the American public remains low at this time, and that the federal government will continue working in close coordination with state and local governments to keep it that way.""
Our ruling
Edwards said of the coronavirus threat, ""there was not a single suggestion by anyone, a doctor, a scientist, a political figure, that we needed to cancel Mardi Gras.""
New Orleans Mardi Gras celebrations began early January and ended Feb. 25. PolitiFact reviewed public comments from Trump, federal and state health officials on and before Feb. 25 and did not find suggestions that large public events be cancelled. At that time, there was no report of community spread of the virus.
Edwards’ statement is accurate. We rate it True.",CNN Transcripts — State of Union,http://transcripts.cnn.com/TRANSCRIPTS/2004/05/sotu.01.html,null,,null,,,,,,
1625020959-24,https://www.politifact.com/factchecks/list/?page=1&category=coronavirus&ruling=true,“Research illustrates a clear correlation between vitamin D deficiencies and (higher) COVID-19 mortality rates.”,"stated on May 21, 2020 in news release:",Glenn Grothman,“Research illustrates a clear correlation between vitamin D deficiencies and (higher) COVID-19 mortality rates.”,https://www.politifact.com/factchecks/2020/jun/08/glenn-grothman/glenn-grothman-target-about-tie-between-vitamin-d-/,"Public Health




Wisconsin




Coronavirus







Glenn Grothman","Glenn Grothman on target about tie between vitamin D and COVID-19, but vitamin D isn’t a known cure




If Your Time is short





U.S. Rep. Glenn Grothman touted a correlation between vitamin D deficiencies and COVID-19 deaths, suggesting the supplement may help combat the virus. 


Early research verifies that correlation, but more work needs to be done. 


Grothman emphasized that point and didn’t imply vitamin D is a cure for COVID-19. 





See the sources for this fact-check




People across the globe continue to seek answers on how to defeat the coronavirus that has sickened millions.
One proposed solution has gained attention in recent weeks: Vitamin D.
A link between vitamin D and COVID-19, the disease caused by the coronavirus, caught the eye of U.S. Rep. Glenn Grothman, R-Glenbeulah. 
In a May 21, 2020 news release, Grothman encouraged the Centers for Disease Control and Prevention to look into vitamin D’s impact on the virus. 
""Research illustrates a clear correlation between vitamin D deficiencies and (higher) COVID-19 mortality rates,"" the release said.
Studies cited by Grothman do suggest vitamin D deficiencies may have contributed to COVID-19 deaths in some countries. But many questions remain about the relationship between the two, and researchers say more work should be done to better understand it.
Is Grothman right about the correlation?
Vitamin D and COVID-19 deaths
Grothman’s news release cited studies out of Northwestern University and Trinity College in Dublin that reached similar conclusions: Countries with more deaths from the virus, such as Spain and Italy, also had higher rates of vitamin D deficiencies. 
""We saw a significant correlation with vitamin D deficiency,"" Vadim Backman, a Northwestern professor who helped author one study, told the university website Northwestern Now.
Why look into vitamin D in the first place?
Aside from building healthy bones, vitamin D can boost the immune system by suppressing what’s called a cytokine storm — severe inflammation that occurs when the immune system becomes overactive and releases too many cytokine proteins.
Backman said cytokine storms may contribute to COVID-19 deaths because the storms can damage people’s lungs. An April 17, 2020 article on WebMD also indicated that patients with severe COVID-19 symptoms had high levels of cytokines in their system.
The idea, then, is that vitamin D could suppress a catastrophic immune response and prevent people from developing severe COVID-19 symptoms that lead to death.

Featured Fact-check
















Instagram posts


stated on June 2, 2021 in an Instagram post








An email from Dr. Anthony Fauci shows ""everyone was lied to"" about wearing masks to prevent the spread of COVID-19.












By Tom Kertscher • June 2, 2021







""It will not prevent a patient from contracting the virus, but it may reduce complications and prevent death in those who are infected,"" Backman said in the interview.
Let’s return to Grothman.
He did not say researchers found a connection, only a correlation between vitamin D levels and COVID-19 deaths. That’s on target. Vitamin D is by no means a cure for the virus, and Grothman conceded that we don’t yet know the extent of the relationship.
In an interview with PolitiFact Wisconsin, Grothman reiterated his belief that federal agencies should further explore the issue. 
""I think a lot of times, the CDC and (National Institutes of Health) and that crowd primarily focus on new drugs,"" he said. ""If you have something right under your nose, let’s go with it.""
What researchers say
For now, researchers caution against reading too much into the available studies. 
J. Wesley Pike, a biochemistry professor at the University of Wisconsin-Madison, said there is not enough proof yet to suggest a meaningful relationship between vitamin D and COVID-19. Researchers will need to conduct further studies to determine if that vitamin is effective in combating the coronavirus.
""There’s simply no evidence that taking vitamin D will protect you,"" Pike said. ""But again, we don’t know. The answer is it’s possible."" 
A group of researchers in Europe and the United Kingdom noted in a May 2020 paper that vitamin D supports the immune system and is recommended to help people maintain a healthy lifestyle. People can up their intake and avoid deficiencies through supplements, eating vitamin D-rich food and getting safe sunlight exposure.
But vitamin D is not a ""magic bullet"" to prevent or treat COVID-19, they wrote, and should not be taken in excessive doses that could present their own health risks.
Our ruling
Grothman claimed ""research illustrates a clear correlation between vitamin D deficiencies and (higher) COVID-19 mortality rates.""
Early studies into vitamin D suggests it may curb the severity of COVID-19 symptoms and reduce mortality rates. Further research is needed to examine the issue, and vitamin D is not a cure for the coronavirus. 
But Grothman did not say it was a cure, only that there was a correlation. One expert noted the correlation was ""significant""
We rate his claim True. 
See Figure 1 on PolitiFact.com",Vitamin D and Inflammation: Potential Implications for Severity of Covid-19,http://imj.ie/vitamin-d-and-inflammation-potential-implications-for-severity-of-covid-19/,null,,null,,,,,,
1625020724-7,https://www.politifact.com/factchecks/list/?page=2&category=coronavirus&ruling=true,“No city in the state can quarantine itself without state approval.”,"stated on March 17, 2020 in a news conference:",Andrew Cuomo,“No city in the state can quarantine itself without state approval.”,https://www.politifact.com/factchecks/2020/mar/20/andrew-cuomo/cuomo-correctly-says-no-quarantine-without-state-a/,"New York




Coronavirus







Andrew Cuomo",,transcript,https://www.governor.ny.gov/news/video-audio-photos-rush-transcript-governor-cuomo-announces-three-way-agreement-legislature,transcript,https://www1.nyc.gov/office-of-the-mayor/news/159-20/transcript-mayor-de-blasio-holds-media-availability-covid-19,said,https://www1.nyc.gov/office-of-the-mayor/news/159-20/transcript-mayor-de-blasio-holds-media-availability-covid-19,,,,,
1625021119-37,https://www.politifact.com/factchecks/list/?page=1&category=coronavirus&ruling=true,"Georgia has “almost 100,000 more (COVID-19) cases, almost twice as many deaths and almost 600 more nursing home deaths than North Carolina.”","stated on October 14, 2020 in a debate:",Roy Cooper,"Georgia has “almost 100,000 more (COVID-19) cases, almost twice as many deaths and almost 600 more nursing home deaths than North Carolina.”",https://www.politifact.com/factchecks/2020/oct/15/roy-cooper/roy-cooper-compares-georgias-covid-19-numbers-nort/,"Georgia




North Carolina




Coronavirus







Roy Cooper","Roy Cooper compares Georgia's COVID-19 numbers to North Carolina




If Your Time is short




North Carolina Gov. Roy Cooper said Georgia has “almost 100,000 more cases, almost twice as many deaths and almost 600 more nursing home deaths than North Carolina.”
On the night of the debate, data from each state’s health department showed Georgia with about 98,100 more cases and nearly twice as many deaths.
According to U.S. CMS data, Georgia also had 569 more nursing home deaths than North Carolina.




See the sources for this fact-check




Roy Cooper and Dan Forest agree that North Carolina’s coronavirus response stands out among southern states.
But the gubernatorial candidates disagree over whether that’s a good thing.
Democratic Gov. Cooper and Republican Lt. Gov. Forest squared off on Wednesday night for North Carolina’s only gubernatorial debate of the year. At one point in the debate, Forest praised North Carolina’s border states for allowing many businesses to reopen while their respective governments addressed the coronavirus outbreak.
""This COVID science is an interesting thing because you cross the border into South Carolina and South Carolina’s open and people are out there going to restaurants and doing things,"" Forest said. ""You cross into Tennessee and Tennessee is open, you cross into Georgia and Georgia is open. They’re learning how to live with the virus and protect the vulnerable and get people back to work.""
Cooper immediately offered a comparison between North Carolina and Georgia.
""It’s interesting that Dan mentions Georgia … He wants to be like Georgia,"" Cooper said. ""Georgia is about the same size as North Carolina, yet they have almost 100,000 more cases, almost twice as many deaths and almost 600 more nursing home deaths than North Carolina.""
Cooper is right about the sizes of North Carolina and Georgia. Georgia is the eighth most populous state in the U.S. and North Carolina is the ninth most populous, according to 2019 census data. The states are separated by fewer than 130,000 people.
So what about those stats Cooper mentioned?
Cooper spokeswoman Liz Doherty referred us to a coronavirus tracker on the New York Times website and nursing home data on the Centers for Medicare and Medicaid Services website. PolitiFact North Carolina also looked at information on the North Carolina and Georgia state websites.
Case counts vary a little bit, depending on the source. But otherwise, Cooper is mostly spot-on.
Comparing cases
Cooper said Georgia has almost 100,000 more cases than North Carolina. On the night of the debate, data from each state’s health department showed Georgia with about 98,100 more cases. So Cooper’s not far off. 
North Carolina’s health department reported 236,407 confirmed cases and Georgia’s health department reported 334,601 cases. 

Featured Fact-check
















Viral image


stated on June 1, 2021 in a Facebook post








“U.S. military arrests Dr. Deborah Birx.”












By Ciara O'Rourke • June 2, 2021







The New York Times map showed 236,810 cases for North Carolina and 319,609 total cases for Georgia, for a difference of about 82,800.
Cooper didn’t compare each state’s infection numbers to its population. But that statistic provides useful context.
The night of the debate, the New York Times’ reported that North Carolina had 2,258 cases per 100,000 residents and Georgia had 3,010 cases per 100,000 residents.
Comparing deaths
Cooper said Georgia had ""almost twice as many deaths"" as North Carolina. This claim is on track too.
On the night of the debate, North Carolina’s health department reported 3,856 total deaths. Twice that many would be 7,712 deaths. Georgia’s health department reported 7,470 total deaths. 
The Times, meanwhile, reported 3,882 total deaths in North Carolina (a rate of 37 deaths per 100,000 residents) and 7,298 total deaths in Georgia (meaning 69 deaths per 100,000 people.)
So if you look at total deaths, the Times and the NC health department both show there have been about 3,800. Georgia is 200 to 400 deaths away from having twice as many. 
Nursing homes
Finally, let’s look at nursing homes.
Cooper said Georgia has had almost 600 more nursing home deaths than North Carolina. On debate night, data tracked by the federal government showed Georgia having 569 more nursing home deaths than North Carolina.
CMS reported 1,328 nursing home deaths in North Carolina and 1,897 in Georgia.
Cooper didn’t mention nursing home cases. To round out the full picture, we’ll report them anyway.
On the night of the debate, CMS reported 6,523 total nursing home cases in North Carolina and 9,483 total cases in Georgia.
Our ruling
Cooper said Georgia has ""almost 100,000 more cases, almost twice as many deaths and almost 600 more nursing home deaths than North Carolina.""
His claim about cases requires the most rounding, but isn’t far off. But his claim about deaths — in total and in nursing homes — are spot-on. We rate this claim True.","Cooper, Forest engage in lone gubernatorial debate",https://www.wral.com/cooper-forest-engage-in-lone-gubernatorial-debate/19336788/,null,,North Carolina’s only gubernatorial debate of the year,https://www.wral.com/cooper-forest-engage-in-lone-gubernatorial-debate/19336788/,,,,,
1625020827-14,https://www.politifact.com/factchecks/list/?page=2&category=coronavirus&ruling=true,“Africans living in China now being forced to sleep outside in the cold” as “Chinese nationals blame them for the rising number of new coronavirus cases in the country.”,"stated on April 16, 2020 in a post on Facebook:",Facebook posts,“Africans living in China now being forced to sleep outside in the cold” as “Chinese nationals blame them for the rising number of new coronavirus cases in the country.”,https://www.politifact.com/factchecks/2020/apr/16/facebook-posts/yes-africans-are-being-evicted-china-amid-fear-sec/,"China




Facebook Fact-checks




Coronavirus







Facebook posts",,post,https://www.facebook.com/1MillionAfricansTheTrilogy/?__tn__=kC-R&eid=ARCuNpzYLKDjjU-hGAVPPqLEiE7R8JEfkeYfkhoRdBvEgkUgH0vWx24MhawK4ev5rXCQ9jZefNHdLXlN&hc_ref=ARSlrez_NHlh3GZE9Omk_9kZHrU3P6Ldda4FoICswj6EhcIePiqGFuGg4A5W0aPd0Q0&fref=nf&__xts__[0]=68.ARD96ASrEGorf_gyzaPRSTQneK-FZFuRmXFF1C_dlI4N0TPQFudJvfrYzLobTmOqMtcqFTZv-V923vz0kXrliW6g9NgkEsG8tUN4DJ_j1Bz2fakOI7QXXdSl3a-cV0hesm5j3z_CAOP_fAnBu3M5A5Uld9PwQph6MkameFEbO5yxTMIXzZiTatM3C2zz1lGLh31Ce0hbBMiDnm8USRRr1ufCorEaedJXhXwZF8nwikBNAh1aNp2SYzSpo-kYNld0m0BMqtrOn6o4uilJUH62wiBiIvsC_PSrqkGbyRIs7zkdlWUi9rDkhs903nZBnBTrJ0AJSlKdpzZK2BBksdHB,"""African nations, US decry racism against blacks in China,""",https://apnews.com/776dec4ec1d06779a34ecc5c4863d427,The Savoy Show,https://www.youtube.com/channel/UCLlDUIS0pjfISImGYxUKwvw/featured,,,,,
