web-scraper-order,web-scraper-start-url,tiltle,date,Sourse,link,link-href,key_words,whole_text,first_source,first_source-href,second_sourse,second_sourse-href,third_source,third_source-href,,,,,
1625022090-80,https://www.politifact.com/factchecks/list/?page=2&category=coronavirus&ruling=mostly-true,A long list shows “new CDC guidelines for reopening schools.”,"stated on May 20, 2020 in a Facebook post:",Viral image,A long list shows “new CDC guidelines for reopening schools.”,https://www.politifact.com/factchecks/2020/may/22/viral-image/cdc-has-new-suggestions-how-protect-students-and-s/,"Facebook Fact-checks




Coronavirus







Viral image","Reviewing CDC's suggestions for how protect students and educators from the coronavirus




If Your Time is short




This image is not from the CDC website, but it roughly summarizes suggestions the agency has for reopening schools as safely as possible.




See the sources for this fact-check




As school districts grapple with how to educate students in the next academic year amid the coronavirus, a list summarizing some of the federal government’s suggestions for how to safely return to the classroom is being shared on social media — but it’s missing some context.
Some people reading the list on social media are misinterpreting these suggestions as mandates. But the language throughout the CDC’s actual advice comes with numerous caveats such as ""when possible,"" ""schools may consider,""and ""as feasible."" 
""Here we go,"" begins the text of the image being shared widely on Facebook. ""New CDC guidelines for reopening schools."" They’re written as follows: 

Wear masks over the age of 2
No sharing of any items or supplies, all belongings in individual cubbies or labeled containers; no sharing electronic devices, toys, games, learning aids
Desks 6 feet apart, all facing the same way
Distance on school buses- one child per seat, skip rows
Install sneeze guards and partitions wherever you cannot space 6ft apart
One way routes in hallways; tape on sidewalks and walls to assure kids stay 6ft apart
No communal shared spaces - cafeterias, playgrounds
Physical barriers or screens between sinks in bathrooms
Only pre-packaged boxes or bags of food instead of cafeteria food; kids eat in classrooms
No field trips, assemblies, or external organizations in schools. Limit volunteers and visitors. 
Same children stay with same staff all day, no switching groups or teachers. 
Stagger arrival and departure times for students to limit exposure to crowds of kids. 
If possible, daily health and temperature checks. 
And several rules about cleaning and disinfecting throughout the day and hand washing frequently.

""This is off CDC website about school starting back in the fall,"" one account wrote about the image, linking to a web page about ""considerations for schools"" on the Centers for Disease Control and Prevention website. 
This post was flagged as part of Facebook’s efforts to combat false news and misinformation on its News Feed. (Read more about our partnership with Facebook.) 
The inconsistent punctuation and casual language — ""here we go"" — were the first clues: this image of ""guidelines"" isn’t directly from the CDC website. But the CDC did update its ""considerations for schools"" on May 19, describing ""ways in which schools can help protect students, teachers, administrators, and staff and slow the spread of COVID-19."" 
These are not mandates. Rather, the CDC says, schools can work with state and local health officials to decide ""whether and how to implement these considerations while adjusting to meet the unique needs and circumstances of the local community."" Implementation ""should be guided by what is feasible, practical, acceptable, and tailored to the needs of each community."" 
The agency notes that online classes and activities are the least risky way to educate kids. Small, in-person classes with students social distancing are riskier, while full-sized, in-person classes where students aren’t spaced apart and share supplies pose the highest risk.
The CDC also released on May 19 what the Washington Post described as a ""low-key guide to reopening,"" including ""a raft of social distancing policies"" schools. Let’s look at what the agency says compared to the list circulating on Facebook.
We’ll break it down and show you what the CDC actually said: 
""Wear masks over the age of 2""
Yes, the CDC says children younger than 2 should not wear masks. As for kids over the age of 2, though, it suggests schools ""teach and reinforce use of cloth face coverings"" and notes that masks are most essential when physical distancing is difficult.
""No sharing of any items or supplies, all belongings in individual cubbies or labeled containers; no sharing electronic devices, toys, games, learning aids""
The CDC says ""schools may consider"" implementing strategies that include avoiding sharing electronic devices, toys, books and other games or learning aids, and limiting the use of shared gym or PE equipment, art supplies, toys and games. ""Discourage sharing of items that are difficult to clean or disinfect,"" it says. ""Keep each child’s belongings separated from others’ and in individually labeled containers, cubbies or areas."" 
""Desks 6 feet apart, all facing the same way""
This is mostly right. The CDC does recommend desks and student seats be at least 6 feet apart ""when feasible."" And, it says, ""turn desks to face in the same direction (rather than facing each other), or have students sit on only one side of tables, space apart.""
""Distance on school buses- one child per seat, skip rows""
Yes, ""when possible"" the CDC suggests creating distance between children on buses. It gives as an example the idea of seating only one child per row and skipping rows.
""Install sneeze guards and partitions wherever you cannot space 6ft apart""

Featured Fact-check
















Instagram posts


stated on June 2, 2021 in an Instagram post








An email from Dr. Anthony Fauci shows ""everyone was lied to"" about wearing masks to prevent the spread of COVID-19.












By Tom Kertscher • June 2, 2021







It says to ""install physical barriers"" in areas where it is hard for people to keep at least 6 feet apart. Sneeze guards and partitions are examples of such barriers.
""One way routes in hallways; tape on sidewalks and walls to assure kids stay 6ft apart""
In areas where it’s hard for people to keep 6-feet apart, ""physical guides, such as tape on floors or sidewalks and signs on walls,"" can be used to help make one-way hallway routes. 
""No communal shared spaces - cafeterias, playgrounds""
Yes, the CDC suggests closing communal spaces like dining halls and playgrounds with shared playground equipment ""if possible."" ""Otherwise,"" it says, ""stagger use and clean and disinfect between use.""
""Physical barriers or screens between sinks in bathrooms""
Yes, the CDC suggests adding ""physical barriers, such as plastic flexible screens, between bathroom sinks especially when they cannot be at least 6 feet apart.""
""Only pre-packaged boxes or bags of food instead of cafeteria food; kids eat in classrooms""
""As feasible,"" kids should bring their own meals or else schools should ""serve individually plated meals in classrooms instead of in a communal dining hall or cafeteria."" At events, the CDC recommends food come in pre-packaged, single-serve boxes or bags instead of a buffet or family-style meal.
""No field trips, assemblies, or external organizations in schools. Limit volunteers and visitors."" 
It does recommend that schools opt for ""virtual activities"" instead of field trips, student assemblies, special performances, school-wide parent meetings, and spirit nights."" Nonessential visitors and volunteers should also be limited ""as possible.""
""Same children stay with same staff all day, no switching groups or teachers."" 
Essentially, yes, but without the hard line: ""Ensure that student and staff groupings are as static as possible by having the same group of children stay with the same staff (all day for young children, and as much as possible for older children). Limit mixing between groups, if possible.""
""Stagger arrival and departure times for students to limit exposure to crowds of kids."" 
The CDC suggests staggering arrival and drop-off times or locations in groups of students, or putting protocols in place to limit contact between each group.
""If possible, daily health and temperature checks."" 
""If feasible, conduct daily health checks (e.g., temperature screening and/or symptom checking) of staff and students.""
""And several rules about cleaning and disinfecting throughout the day and hand washing frequently.""
The CDC says to ""teach and reinforce handwashing with soap and water for at least 20 seconds"" and advises schools to provide hand sanitizer if soap and water aren’t readily available. It also suggests cleaning and disinfecting touched surfaces like playground equipment, door handles, sink handles and water fountains at least daily or between use as much as possible. 
Our ruling
The image being shared on Facebook roughly summarizes some of the CDC’s suggestions for reopening schools amid the new coronavirus. But the guidelines listed are not mandated by the CDC, and they’re not comprehensive — the agency has other suggestions not mentioned in the image, such as offering options to protect staff and students who have a higher risk of severe illness. 
We rate this post Mostly True.",post,https://www.facebook.com/photo.php?fbid=3629347877081368&set=a.102440126438845&type=3&theater,Considerations for schools,https://www.cdc.gov/coronavirus/2019-ncov/community/schools-childcare/schools.html?fbclid=IwAR2S84hh0mV1AYtJK_6rk0liWE3TGfbIgiX5CBxINCHT06vSDchg_fjk558,shared widely on Facebook,https://www.facebook.com/photo.php?fbid=3629347877081368&set=a.102440126438845&type=3&theater,,,,,
1625022628-119,https://www.politifact.com/factchecks/list/?page=1&category=coronavirus&ruling=mostly-true,"For mitigating COVID-19 spread, “masks (are) the number one way to do so.""","stated on April 11, 2021 in TV interview:",Jill Underly,"For mitigating COVID-19 spread, “masks (are) the number one way to do so.""",https://www.politifact.com/factchecks/2021/apr/23/jill-underly/wisconsin-schools-leader-mark-claim-masks-are-fact/,"Children




Public Health




Wisconsin




Coronavirus







Jill Underly","Wisconsin schools leader on the mark with claim that masks are factor in mitigating COVID spread




If Your Time is short



 


We could not locate a study that ranked the various methods for mitigating spread of the coronavirus. 


But experts agree that mask wearing is a primary way to do so, albeit in conjunction with other steps, such as hand-washing, social-distancing and -- now that vaccines are available -- getting a shot





See the sources for this fact-check




More than a year into the coronavirus pandemic, debate remains around a central means of combating the spread of COVID-19: To wear or not to wear a mask.
At least the debate still exists among the general public and some politicians. Science and public health experts have pretty much all come down on one side: Mask up.
That’s where newly-elected Superintendent of Public Instruction Jill Underly fell when asked for her opinion on school mask requirements during an interview April 11, 2021 on WISN’s ""UpFront."" 
""As far as mitigating spread, they say that masks is the number one way to do so,"" Underly said. ""And I feel that is, that's what we need to do to keep our buildings open. I think we should be wearing masks. But again, that's my recommendation, I believe in the science. But I do feel that each school district is going to have to make that decision for themselves."" 
Underly made the comment at a point when thousands of students in Milwaukee Public Schools and the Madison Metropolitan School District were returning to the classroom, at least on a hybrid basis, for the first time since the pandemic began. Most other other districts in the state had been operating in person for months, some from the start of the school year last fall.
Still, there has been pushback against the decisions, including by the Milwaukee Teachers’ Education Association, the teacher’s union, which has questioned the safety of returning to in-person learning.
Let’s focus on Underly’s claim about mask’s being the best way to mitigate COVID-19 spread.
How does wearing masks rate?
In February, we rated True a claim by Assembly Minority Leader Gordon Hintz, D-Oshkosh, that ""we know mask mandates work. There’s enough evidence out there between counties that have done it and counties that haven’t.""
Nothing has changed since then in terms of the science behind the effectiveness of masks.
But what about Underly’s claim that masks rank at the top of the mitigation list?
When asked for backup for the claim, Erin Forrest of Underly’s transition team emailed a list of articles and studies related to the science behind masks, including a University of California San Francisco June 26, 2020 paper ""Still Confused About Masks? Here’s the Science Behind How Face Masks Prevent Coronavirus"" and the U.S. Food and Drug Administration ""Face Masks, Including Surgical Masks, and Respirators for COVID-19.""
""It’s also important to note that right now there is no vaccine approved for people under 16 years of age,"" Forrest said in an email to PolitiFact Wisconsin.   
But she did not cite any study that ranked the various methods for mitigating spread of the coronavirus. We could not find any either in our search. 
That said, experts agree that mask wearing is a primary way to do so, albeit in conjunction with other steps, such as hand-washing, social-distancing and -- now that vaccines are available -- getting a shot.
Ajay Sethi, an epidemiologist and professor at the University of Wisconsin-Madison, told us wearing a properly fitted mask is ""imperative."" 
""Both masks and physical distancing are needed to interrupt transmission of the coronavirus in indoor environments,"" Sethi said in an email to PolitiFact Wisconsin. ""When food or drink is being served for consumption, then maintaining proper physical distance is imperative. When maintaining physical distance is challenging, then wearing a high quality, properly fit mask is imperative. Ideally, both wearing masks and maintaining physical distancing are being done together.""

Featured Fact-check
















Instagram posts


stated on June 2, 2021 in an Instagram post








An email from Dr. Anthony Fauci shows ""everyone was lied to"" about wearing masks to prevent the spread of COVID-19.












By Tom Kertscher • June 2, 2021







City of Milwaukee Health Commissioner Kirsten Johnson told us: ""Masking is at the top of the list for the Milwaukee Health Department. Combined with vaccination, that is the best way to stop COVID."" 
That point is echoed in numerous other places.
Harvard Medical School puts mask wearing at the top of its list of steps individuals can take. Yale Medicine includes it on its list, and the Centers for Disease Control and Prevention issued guidance April 6, 2021on improving the fit and filtration of masks that included this note: ""Correct and consistent mask use is a critical step everyone can take to reduce their risk of getting and spreading COVID-19.""
Finally, the World Health Organization, in a Q&A posted on its website, notes that ""masks are a key measure to suppress transmission and save lives.""
The website goes on to say:
""Masks should be used as part of a comprehensive ‘Do it all!’ approach including physical distancing, avoiding crowded, closed and close-contact settings, good ventilation, cleaning hands, covering sneezes and coughs, and more.""
Our ruling
Underly said for mitigating COVID-19 spread, ""masks (are) the number one way to do so."" 
Experts at the local, national (CDC) and international (WHO) level, all say that masks are vital to lowering the risk of spreading COVID-19. That said, they also note simply wearing a mask is not enough and that other mitigation strategies, such as vaccination, social distancing and hand washing are also important. 
And, for the most part, students cannot be vaccinated. The vaccines are only available to those 16 and older.
We rate Underly’s claim Mostly True.
PolitiFact: No, WHO didn’t just say you don’t need to wear a mask 
PolitiFact: Mask skeptics ask questions. PolitiFact answers 
PolitiFact: Masks for COVID-19 are effective, as a six-part Facebook takedown fails",UpFront,https://www.wisn.com/article/upfront-recap-each-school-district-should-make-mask-decision-underly-says/36085430,"Wisconsin Supreme Court overturns statewide mask mandate, blocks Evers from declaring multiple emergency orders",https://www.jsonline.com/story/news/politics/2021/03/31/supreme-court-blocks-tony-evers-extending-covid-mask-mandate/7060433002/,11-Apr-21,https://www.wisn.com/article/upfront-recap-each-school-district-should-make-mask-decision-underly-says/36085430,,,,,
1625021962-69,https://www.politifact.com/factchecks/list/?page=2&category=coronavirus&ruling=mostly-true,COVID-19 is “here to stay” and “we need to accept that and be prepared to deal with COVID long term.”,"stated on April 26, 2020 in a Facebook post:",Facebook posts,COVID-19 is “here to stay” and “we need to accept that and be prepared to deal with COVID long term.”,https://www.politifact.com/factchecks/2020/apr/29/facebook-posts/experts-say-covid-19-may-well-be-here-stay-even-af/,"Health Care




Public Health




Wisconsin




Coronavirus







Facebook posts","Experts say COVID-19 may well be “here to stay,” even after a vaccine




If Your Time is short





Arguing for relaxing restrictions, the speaker was making the point that staying indoors for another month or two won’t get rid of the virus.


Experts say it’s too early to say for sure, but it’s  eradicating COVID-19 will be a difficult undertaking — even after a vaccine


Many expect it to remain in the environment and ebb and flow like the seasonal flu





See the sources for this fact-check




The debate over when to re-open Wisconsin has escalated quickly.
Frustration with the extended quarantine is mounting on social media, and residents around the state have defied social distancing orders to attend rallies demanding Gov. Tony Evers ease restrictions.
Protesters say the COVID-19 pandemic has slowed enough to justify reopening, given the mounting economic and health impacts.
One viral Facebook post — making the case to move toward re-opening the state — says we need to get used to living in a world with COVID-19.
It was posted April 26, 2020, by Dr. David Murdock, a research cardiologist with the Aspirus health system in Wausau who was placed on leave after attending an April 19, 2020, re-open rally in Mosinee.
""The consensus medical view is that this virus is here to stay. In other words, this virus cannot be defeated simply by staying inside for a couple of months,"" wrote Murdock, who said he was observing from the rear of the rally at a safe distance to gather material for a memoir. ""The world will likely see periodic outbreaks, and we need to accept that and be prepared to deal with COVID long term.""
This post was flagged as part of Facebook’s efforts to combat false news and misinformation on its News Feed. (Read more about our partnership with Facebook.) 
Murdock makes an array of points in the wide-ranging post, which has been shared more than 2,000 times. But we’re especially interested in the claim about the longevity of COVID-19.
Of course, the ""Safer at Home"" order from Evers —  and similar efforts across the country, including guidance from President Donald Trump —  is not designed to eradicate the disease. It was implemented to slow the spread so hospitals aren’t overwhelmed. 
Understanding that, we still wanted to examine the underlying claim.
COVID-19 has sickened 3 million and killed more than 200,000 globally. Is it really here to stay?
We asked the experts.
Vaccine no guarantee to end COVID-19
Many experts have said a true return to normalcy likely isn’t possible until a vaccine is widely available, which could be a year or more.
""We're going to probably all need to be used to social distancing for the next 12 to 18 months,"" John Raymond, CEO of the Medical College of Wisconsin, said during an April 27, 2020, online briefing for the Greater Milwaukee Committee. ""Until hopefully we have an effective vaccine, it's likely we're going to be living with COVID-19.""
But a vaccine doesn’t necessarily mean the end of COVID-19.
Like much about this coronavirus, this isn’t something we can say for sure yet. But experts we talked to said complete eradication would be a major undertaking.
""Absent a vaccine, I think it would quite likely become like seasonal flu or perhaps like some of the other coronaviruses that we are familiar with,"" said Bill Hanage, an associate professor of epidemiology at Harvard University’s School of Public Health. ""It is entirely plausible that this could become part of our regular landscape of respiratory viraI infections.""

Featured Fact-check
















Instagram posts


stated on June 2, 2021 in an Instagram post








An email from Dr. Anthony Fauci shows ""everyone was lied to"" about wearing masks to prevent the spread of COVID-19.












By Tom Kertscher • June 2, 2021







The vaccine he references would be a theoretical one that is 100% effective and gives lifelong immunity. But vaccines are ""almost never perfect,"" notes Barry Bloom, a professor of public health at Harvard.
Bloom also expressed concern over the volume of misinformation about COVID-19 vaccinations on social media, which include a host of conspiracy theories about pushing people to vaccinate and concerns about how the vaccines may be dangerous. That could affect willingness to take a vaccine once it’s available.
""The vaccine is only a tool if it’s used,"" Bloom said.
What we don’t know
Hanage said an array of key unknowns will determine the long-term future of COVID-19. They include:


Whether people can get re-infected, and how severe those recurrences would be


How much immunity results from minor infections


How the summer warmup alters infectiousness (based on both people’s behavior and the reaction of the virus itself; generally coronaviruses don’t survive as long in warmer weather)


Even if the virus does stick around, though, it may not be the threat it is today.
""If that immunity is not very long-lasting — and we have good reason from other coronaviruses including the original SARS, that it won’t be — what type of infections will people have when their immunity starts to wane?"" Hanage said. ""The first thing to say is we don’t know, but I think it’s also plausible to suggest they might be milder.""
It’s worth noting that SARS — a disease caused by a coronavirus that killed 800 during a 2003 outbreak — has been eradicated. But there are key differences that make COVID-19 a more formidable foe.
In a March 5, 2020, article for The Lancet medical journal, Annelies Wilder-Smith noted COVID-19 can be passed on by those with minor symptoms or none at all (SARS patients generally weren’t contagious until they had severe symptoms). And COVID-19 is more easily transmitted and has had a more prevalent community spread.
""The virus remains, and we need to learn how to deal with it,"" Wilder-Smith, a professor of emerging infectious diseases at the London School of Hygiene and Tropical Medicine told PolitiFact Wisconsin. ""Certainly lock-down is only a temporary solution whilst we gear up to provide the true solution. Yes, we need to prepare for this reality.""
Charles Branas, chair of the epidemiology department at Columbia University’s Mailman School of Public Health, told PolitiFact Wisconsin eradicating the virus like we did with smallpox ""will be challenging, to say the least."" Ali Khan, dean of the College of Public Health and professor of epidemiology at the University of Nebraska Medical Center, said COVID-19 sticking around is ""likely, but not inevitable.""
Khan noted some countries already are attempting to eliminate the virus. China, New Zealand, Australia and Vietnam have all set a goal of not just containment, but elimination. The New York Times reported April 24, 2020 that the adjoining nations of Australia and New Zealand are seeing just a handful of new infections each day and closing in on their ""extraordinary goal.""
Our ruling
A widely shared Facebook post from a Wisconsin doctor said we need to face the reality that COVID-19 is ""here to stay"" and ""we need to accept that and be prepared to deal with COVID long term.""
He was making the point that staying indoors for another month or two with extended shelter-in-place orders won’t get rid of the virus. (Though, as noted, the shelter-in-place orders are not meant to fully eradicate the virus.)
Experts say it’s still too early to know this with complete certainty, since much remains unknown about the nature of immunity. And we have no clue how effective a future vaccine may be.
But a best guess at this point is that COVID-19 could indeed stick around long-term, waxing and waning similar to the seasonal flu. Experts say there’s also reason to believe that lingering version could be less severe, though, a nuance Murdock did not address.
Based on what we know now, we rate this claim Mostly True.",Facebook post,https://www.facebook.com/david.murdock.12/posts/3232767016735722,Bill Hanage,https://www.hsph.harvard.edu/william-hanage/,Barry Bloom,https://www.hsph.harvard.edu/barry-bloom/,,,,,
