web-scraper-order,web-scraper-start-url,tiltle,date,Sourse,link,link-href,key_words,whole_text,first_source,first_source-href,second_sourse,second_sourse-href,third_source,third_source-href,,,,,
1625021066-33,https://www.politifact.com/factchecks/list/?page=1&category=coronavirus&ruling=true,Says the U.S. Senate is “dominated by millionaires” and that he is “not one of them.”,"stated on July 30, 2020 in an interview:",Cory Booker,Says the U.S. Senate is “dominated by millionaires” and that he is “not one of them.”,https://www.politifact.com/factchecks/2020/aug/13/cory-booker/cory-booker-said-us-senate-dominated-millionaires-/,"National




New Jersey




Coronavirus







Cory Booker","Cory Booker said the U.S. Senate is “dominated by millionaires.” Is that true?




If Your Time is short




Net worth data compiled by the nonpartisan Center for Responsive Politics for 2018, the most recent year available, shows that almost two-thirds of U.S. senators’ net worth exceeds $1 million.

 
U.S. Sen. Rick Scott, a Florida Republican, and U.S. Sen. Mark Warner, a Virginia Democrat, are the body’s wealthiest lawmakers. Each reported a net worth of more than $200 million dollars, the data show. 

 
Fifty-seven lawmakers reported net worths of between $1 million and $100 million, including Pennsylvania Republican Pat Toomey, who is worth about $2 million, the data show.




See the sources for this fact-check




When talks to extend emergency coronavirus unemployment relief broke down last month in Washington, U.S. Sen. Cory Booker blamed his wealthy colleagues for the impasse. 
""I’m a little frustrated that a body dominated by millionaires, I’m not one of them, is going to focus on just a few hundred extra bucks and try to cut that out from under so many millions of American families,"" Booker said in an interview with NJTV News.  
We wondered how many members of Congress’ upper chamber really are millionaires.  
Net worth data compiled by the nonpartisan Center for Responsive Politics for 2018, the most recent year available, shows that almost two-thirds of U.S. senators’ net worth exceeds $1 million. And a few of them are exceptionally wealthy. 
Financial disclosure forms lawmakers fill out don’t require exact values, only ranges of values, so the Center for Responsive Politics calculates lawmakers’ net worth by adding their range of assets, subtracting their range of liabilities, and calculating the midpoint of the resulting range. 
U.S. Sen. Rick Scott, a Florida Republican, and U.S. Sen. Mark Warner, a Virginia Democrat, are the body’s wealthiest lawmakers. Each reported a net worth of more than $200 million dollars, the data show. 
Two other senators reported net worths greater than $100 million — Mitt Romney, the former presidential candidate and Utah Republican, and Mike Braun, an Indiana Republican. 
Fifty-seven other lawmakers reported net worths of between $1 million and $100 million, including Pennsylvania Republican Pat Toomey, who is worth about $2 million, the data show.

Featured Fact-check
















Facebook posts


stated on June 2, 2021 in a Facebook post








Emails show ""Fauci's fellow scientist could tell early on that the (coronavirus) looked manufactured.""












By Jon Greenberg • June 2, 2021







In the past, Roll Call analyzed lawmaker wealth by focusing on minimum net worth. 
Booker’s comments came as the federal unemployment benefits Congress approved early in the pandemic were set to expire and negotiations over the next relief package stalled. Democrats want to keep offering unemployed Americans an extra $600 a week. Republicans want to see the extra benefits scaled back or eliminated. 
Booker argued that the Senate’s millionaires don’t support extending the more generous benefits because they don’t know what it’s like to need that money for food and rent. But the Center for Responsive politics data shows that 25 of the Senate’s millionaires are Democrats who want to continue the expanded support. 
Besides Warner, the wealthiest Senate Democrats are Dianne Feinstein of California and Michael Bennett of Colorado. 
So, is Booker a millionaire? 
No. 
His net worth is $807,503, the data show. He has a checking account, a savings account, a pension, a money market account, and several IRAs. His staff also provided a copy of the financial disclosure form Booker filed with the Senate, and it shows the same.  
The data show that Pennsylvania Democrat Bob Casey also has net worth below $1 million. 
Our ruling
Booker said that the Senate is ""dominated by millionaires"" and that he is ""not one of them."" Roughly two-thirds of U.S. senators are millionaires, and no, Booker isn’t one of them, data show. We rate this statement True.",Net Worth - 2018,https://www.opensecrets.org/personal-finances/top-net-worth,"Annual Report for Calendar 2018, The Honorable Cory A Booker (Booker, Cory)",https://efdsearch.senate.gov/search/view/annual/8796c940-0d0d-4579-83ce-edb3d373780c/,Wealth of Congress: Ranking the Net Worth of the 115th,https://www.rollcall.com/wealth-of-congress/,,,,,
1625021234-46,https://www.politifact.com/factchecks/list/?page=1&category=coronavirus&ruling=true,"“We know mask mandates work. There’s enough evidence out there between counties that have done it and counties that haven’t.""","stated on February 5, 2021 in TV interview:",Gordon Hintz,"“We know mask mandates work. There’s enough evidence out there between counties that have done it and counties that haven’t.""",https://www.politifact.com/factchecks/2021/feb/12/gordon-hintz/wisconsin-assembly-minority-leader-right-relations/,"Public Health




Wisconsin




Coronavirus







Gordon Hintz","Wisconsin Assembly Minority Leader right on relationship between mask mandates and COVID-19 cases




If Your Time is short





Multiple studies have suggested mask mandates can lead to a decline in COVID-19 cases. 


Researchers caution that factors like compliance and enforcement should be taken into consideration, but masks have ultimately proven to be an effective tool in combating the virus





See the sources for this fact-check




Masks have once again become a political volleyball in the Wisconsin State Capitol.
Assembly Republicans voted on Feb. 4, 2021 to overturn Gov. Tony Evers’ order requiring people to wear face coverings to mitigate the spread of COVID-19 — sealing the deal after the Senate took action a week prior. Evers responded by immediately issuing a new mandate. 
The next day, Democrats in the Assembly introduced legislation requiring masks, a measure that is likely to go nowhere in the GOP-controlled Legislature.
Amid the back and forth, Democrats chastised their Republican colleagues for playing politics with public health and argued masks are necessary to push the state through the final stages of the pandemic.
Among those to speak out was Assembly Minority Leader Gordon Hintz.
""At the end of the day we know mask mandates work,"" the Oshkosh Democrat said in a Feb. 5, 2021 interview on the Wisconsin Public Television program Here & Now. ""There’s enough evidence out there between counties that have done it and counties that haven’t.""
Is Hintz onto something? Let’s take a look.
Mask mandates in Kansas 
When asked for evidence to support Hintz’s claim, his office pointed to a study by the Centers for Disease Control and Prevention and Kansas Department of Health and Environment that analyzed the impact of mask mandates on Kansas counties.
Kansas’ governor issued an executive order requiring face coverings in public spaces starting July 3, 2020. A state law enacted the month prior allowed counties to opt out of the state mandate, which 81 of 105 did without implementing their own mask rules. 
Researchers found the seven-day rolling average of new daily cases per 100,000 people decreased by 6% in the 24 counties with mask mandates after the governor’s order. In counties without a mandate, COVID-19 incidence increased by 100%. 
The study noted that 13 counties with mask mandates and seven counties without mandates also had other mitigation strategies in place, such as limiting the size of gatherings and how many could eat in restaurants. Still, researchers concluded that ""strategies related to mask use mandates appear to be important.""
""The decrease in cases among mandated counties and the continued increase in cases in nonmandated counties adds to the evidence supporting the importance of wearing masks and implementing policies requiring their use to mitigate the spread of SARS-CoV-2,"" the study stated.

Featured Fact-check
















Instagram posts


stated on June 2, 2021 in an Instagram post








An email from Dr. Anthony Fauci shows ""everyone was lied to"" about wearing masks to prevent the spread of COVID-19.












By Tom Kertscher • June 2, 2021







Additional research 
The Wisconsin Medical Society cited the Kansas study in a Feb. 1, 2021 memo to Assembly lawmakers asking them to oppose the repeal. 
The group also referenced research from Goldman Sachs estimating that mandates gradually increase the number of people who ""always"" or ""frequently"" wear masks by about 25 percentage points, and the number who ""always"" wear masks by 40 points.
Another study published in June 2020 found a ""significant decline"" in daily COVID-19 cases in states with mask mandates, with the effect increasing over time. Researchers cautiously estimated that 230,000 to 450,000 COVID-19 cases may have been averted by May 22, 2020 due to the mandates. 
Meanwhile, researchers in Canada found a 25 to 46% average weekly reduction in new cases in the first few weeks after mandates were adopted, while the number of people who reported always wearing a mask in public increased by about 30 percentage points. 
When studying the impact of mask mandates, it’s important to consider whether people follow them and if they’re enforced, said Ajay Sethi, an epidemiologist and associate professor at the University of Wisconsin-Madison. He said it can be difficult to assess mandates individually when they’re issued with other public health guidelines, but he believes the Kansas study offered compelling data on the matter. 
""You could argue that with or without a mandate, people might wear a mask because that’s what they do and the mandate is just confirming what they do,"" he said. ""At the end of the day, an entire county had fewer cases.""
And ultimately, Sethi said, mandates remind people about the importance of wearing face coverings to guard against COVID-19. 
""If we didn’t have mandates, would you expect mask use to go up?"" he said. ""I wouldn’t.""
Our ruling
In a TV interview, Hintz said, ""At the end of the day we know mask mandates work. There’s enough evidence out there between counties that have done it and counties that haven’t.""
Multiple studies have suggested mask mandates can lead to a decline in COVID-19 cases. Researchers caution that factors like compliance and enforcement should be taken into consideration, but masks have ultimately proven to be an effective tool in combating the virus. 
We rate Hintz’s claim True.",Gov. Tony Evers issues new statewide mask mandate an hour after Republican lawmakers eliminated it,https://www.jsonline.com/story/news/politics/2021/02/04/wisconsin-republicans-try-again-end-tony-evers-mask-mandate/4386525001/,null,,introduced legislation,https://www.tmj4.com/news/coronavirus/wisconsin-democrats-propose-mask-mandate-that-would-last-for-entire-pandemic,,,,,
1625021252-47,https://www.politifact.com/factchecks/list/?page=1&category=coronavirus&ruling=true,"“There’s still (only) a handful of school districts"" doing no in-person instruction.","stated on March 14, 2021 in TV interview:",Tony Evers,"“There’s still (only) a handful of school districts"" doing no in-person instruction.",https://www.politifact.com/factchecks/2021/mar/29/tony-evers/yes-there-are-just-few-wisconsin-school-districts-/,"Children




Education




Wisconsin




Coronavirus







Tony Evers","Yes, there are just a few Wisconsin school districts still doing largely virtual learning




If Your Time is short





A USA TODAY Network-Wisconsin survey found every school district in the state has at least some in-person learning as of March


Milwaukee Public Schools and the Madison Metropolitan School District are the last districts to remain largely virtual, though both have plans to bring students back in April





See the sources for this fact-check




Wisconsin students, parents and educators shouldered a heavy burden over the past year: A patchwork of in-person, hybrid and virtual schooling as the coronavirus devastated the state.
Last March, Gov. Tony Evers closed K-12 schools in an attempt to limit the spread of the virus. A closure meant to last two weeks ended up lasting till the school year’s end, and in the fall, only some returned to the classroom full-time.
Reopening decisions have been fraught with controversy. In Madison, teachers taught outside school buildings in early March 2021 to protest their district’s plan to resume in-person learning, arguing it should have been postponed until staff could get vaccinated.
On the flip side, in early February Republicans in the state Legislature moved to send $66 million in federal aid to schools already holding in-person classes. ""The bottom line is our kids need to be in school,"" state Sen. Howard Marklein, R-Spring Green, said at the time.
Evers has said he wants the decision to reopen to be left up to individual school districts because those officials will best understand how much of a threat COVID-19 poses in their community, a stance in line with Wisconsin’s status as a local-control state.
Appearing on Capital City Sunday on March 14, 2021, the governor said he’s spoken with many superintendents who’ve successfully managed in-person school since last September.
That success depends on class sizes, building ventilation and the landscape of local virus transmission — all factors he said would make it difficult to make a statewide judgment on returning to classrooms.
""There’s still a handful of school districts out,"" Evers said, but added that he’d like to get students back in school.
Is he correct that just a handful of districts are still learning largely online?
Let’s take a look.

Only state’s two largest school districts remain largely virtual, survey finds

State officials have chosen not to track district reopenings since the end of mandatory closures last June.

Featured Fact-check
















Viral image


stated on June 1, 2021 in a Facebook post








“U.S. military arrests Dr. Deborah Birx.”












By Ciara O'Rourke • June 2, 2021







However, a USA TODAY Network-Wisconsin survey of Wisconsin’s regional education agencies found that every district currently has at least some in-person instruction, and only the Madison Metropolitan School District and Milwaukee Public Schools remain mostly virtual.
In Madison, only the youngest students have returned to school buildings, while students in grades 3 and up are set to return in phases beginning in April. MPS offers an in-person option for some students with disabilities and could begin bringing others back starting April 12, 2021.
Wisconsin has 12 Cooperative Educational Service Agencies, known as CESAs, that help communicate between the state’s Department of Public Instruction and its 422 school districts. Seven CESA administrators surveyed said collectively, there were 150 districts in their jurisdiction where all students can attend school five days a week. Thirty-nine districts use a blended model, where students are in school part of the week and learn virtually on other days.
Other CESA administrators said they weren’t tracking how many districts were teaching students in-person or blended, but did say all districts were back to some in-person learning.
While some students have been back in the classroom since September, more moved to come back after winter break. Such was the case for the Appleton Area School District, for example, the sixth-largest in the state.
School districts generally have virtual options for students and families who did not feel safe returning to the school building, the survey found.
David Honish, agency administrator of CESA 8 in northeastern Wisconsin, told a reporter that ""you have people almost making the assumption"" that districts aren’t back face-to-face, even when that isn’t the case.
While many districts in his region began the school year virtually or in a hybrid model, most have returned to in-person learning, Honish said, with a few exceptions — including one high school that went virtual for two weeks after a COVID-19 outbreak.
Districts are required to notify their local health department when they learn of at least two confirmed cases of COVID-19 in the same building within two weeks. 

Our ruling

Evers said there were still a handful of districts learning mostly virtually.
A USA TODAY Network-Wisconsin survey found only the state’s two largest school districts were keeping students mostly virtual, although even they have limited in-person options and are planning April returns.
We rate his claim True.","""Wisconsin closes all schools to prevent spread of coronavirus pandemic,""",https://www.postcrescent.com/story/news/education/2020/03/13/wisconsin-schools-required-close-prevent-spread-coronavirus-pandemic/5041148002/,null,,teachers taught outside school buildings,https://madison.com/ct/news/local/education/local_schools/teachers-set-up-outside-school-buildings-in-protest-of-madison-school-district-reopening-plan/article_02bf9697-81c9-59b2-a2cf-eb319666fa02.html,,,,,
1625020915-21,https://www.politifact.com/factchecks/list/?page=1&category=coronavirus&ruling=true,“Small trials” to test convalescent plasma therapy for coronavirus patients “seem to have had some degree of success.”,"stated on April 14, 2020 in a newspaper interview:",Jamie Nadler,“Small trials” to test convalescent plasma therapy for coronavirus patients “seem to have had some degree of success.”,https://www.politifact.com/factchecks/2020/apr/29/jamie-nadler/convalescent-plasma-therapy-showing-promise-agains/,"Health Care




Public Health




New York




Coronavirus







Jamie Nadler","Convalescent plasma therapy showing promise against COVID-19




If Your Time is short



• At least two Chinese studies have found initial success with convalescent plasma therapy, a technique in which antibodies from recovered coronavirus patients are given to seriously ill patients in order to boost their immune response.
• The authors of these studies emphasize that more research is needed to confirm these results more broadly.



See the sources for this fact-check




As physicians grapple with the best ways to treat patients infected with the coronavirus, one treatment that has gained increasing attention is convalescent plasma therapy.
This therapy involves transfusing blood plasma from recovered coronavirus patients into a sick patient. The plasma contains a specific antibody that helps the immune system fight the virus. The idea is to help give seriously ill patients an immune-system boost so they can better fight off the virus.
COVID-19 convalescent plasma therapy is considered as an investigational product by the Food and Drug Administration. 
Dr. Jamie N. Nadler, the medical director of quality and patient safety for Buffalo General Medical Center and Gates Vascular Institute in upstate New York, recently told the Buffalo News that there’s some evidence that it could be an effective way to treat COVID-19. 
""There have been small trials and small attempts around the world that seem to have had some degree of success,"" Nadler said. ""So it's worth trying as long as it's done correctly.""
Nadler is right: We found two studies of convalescent plasma therapy that have shown  at least initial promise with COVID-19 patients, although experts caution that more investigation is needed. (Nadler did not respond to an inquiry for this article.)
A brief history of convalescent plasma therapy
Convalescent plasma therapy has a long history. It was developed by Paul Ehrlich and Emil von Behring for treatment of diphtheria, a finding that was recognized in 1901 with the first Nobel Prize for medicine, epidemiologist Dr. Ian Lipkin, a professor at Columbia University’s Mailman School of Public Health, told CNBC. 
More recently, it was used against Severe Acute Respiratory Syndrome, an infection with similarities to COVID-19 that emerged in Asia in the early 2000s. 
In one study in Hong Kong during a SARS outbreak, a hospital treated 80 patients with convalescent plasma. Among the treated patients, the study showed a higher discharge rate prior to day 14 of the illness: 58.3% became well enough to be discharged, compared with 15.6% of those who did not receive the treatment.
However, patients suffering from Ebola — a different kind of virus in the filovirus family — did not experience positive results from convalescent plasma treatment. 

Featured Fact-check
















Instagram posts


stated on June 2, 2021 in an Instagram post








An email from Dr. Anthony Fauci shows ""everyone was lied to"" about wearing masks to prevent the spread of COVID-19.












By Tom Kertscher • June 2, 2021







A study from China in the Journal of the American Medical Association
A Chinese study, published in the Journal of the American Medical Association, described a study treating five critically ill COVID-19 patients with convalescent plasma. All five patients, ranging from 36 to 65 years old, began the study while on ventilators. 
Following the transfusion, the authors reported, four of the five patients’ body temperatures normalized within three days. Other key metrics, including viral loads, improved within 12 days.
The hospital discharged three of the five patients. The remaining two were in stable condition 37 days after the transfusion. 
The authors concluded that this represented an ""improvement,"" but cautioned that the limited sample size and study design precluded ""a definitive statement about the potential effectiveness of this treatment.""
A pre-publication study from China that has been posted online
Another Chinese study found similar results. It has not yet been peer reviewed but has been published online. 
In the study, 10 patients with severe cases received a dose of convalescent plasma. Within three days, the viral load became undetectable in seven patients, with no adverse effects. In addition, fever, cough, shortness of breath and chest pain disappeared or significantly improved in all 10 patients within one to three days of the transfusion.  
The authors concluded that the therapy was ""well tolerated and could potentially improve the clinical outcomes"" in severe COVID-19 cases. However, they added, questions on the optimal dose and timing need further investigation.
""Just as COVID-19 has taken us back to classic methods for outbreak containment like isolation, through a novel use we are rediscovering the lifesaving potential of a classic strategy like plasma therapy,"" Lipkin said. 
Experts say that convalescent plasma therapy is promising, but much more work is needed.
""There have not been any breakthroughs recently,"" said Jessica Donington, a professor of surgery at the University of Chicago and chief of the thoracic surgery section. But, she added, ""it all has been going on very quickly,"" with larger clinical trials in the works.
Our ruling
Nadler said that ""there have been small trials and small attempts around the world"" to test convalescent plasma therapy for coronavirus patients, and they ""seem to have had some degree of success.""
We found two Chinese studies that have found initial success, though more research is needed to confirm these results more broadly. We rate the statement True.",Regional hospitals to offer COVID-19 antibody infusions to seriously ill patients,https://buffalonews.com/2020/04/14/regional-hospitals-to-offer-covid-19-antibody-infusions-to-seriously-ill-patients/,Convalescent Plasma: A Therapy for COVID-19?,https://discoverysedge.mayo.edu/2020/04/06/convalescent-plasma-a-therapy-for-covid-19/,Food and Drug Administration,https://www.fda.gov/vaccines-blood-biologics/investigational-new-drug-ind-or-device-exemption-ide-process-cber/recommendations-investigational-covid-19-convalescent-plasma,,,,,
