web-scraper-order,web-scraper-start-url,tiltle,date,Sourse,link,link-href,key_words,whole_text,first_source,first_source-href,second_sourse,second_sourse-href,third_source,third_source-href
1625025187-263,https://www.politifact.com/factchecks/list/?page=3&category=coronavirus&ruling=barely-true,"In voting by mail, “hundreds of thousands of ballots have been rejected for defects and millions more end up missing or in landfills.”","stated on June 3, 2020 in a House judiciary hearing:",J. Christian Adams,"In voting by mail, “hundreds of thousands of ballots have been rejected for defects and millions more end up missing or in landfills.”",https://www.politifact.com/factchecks/2020/jun/09/j-christian-adams/misleading-claim-millions-absentee-ballots-end-mis/,"Elections




Coronavirus







J. Christian Adams","The misleading claim that millions of absentee ballots end up ‘missing or in landfills’




If Your Time is short





A conservative legal group’s report said that during the past four general elections, about 28 million ballots were recorded by the government as “unknown” after they were mailed.


These included ballots that were not returned by the voter, spoiled, returned as undeliverable, or otherwise unable to be tracked. Experts said it’s wrong to categorize these as “missing.”


Some ballots are rejected for missing or mismatched signatures, or for arriving too late, but they represent a small proportion of ballots issued.





See the sources for this fact-check




The coronavirus pandemic has escalated the political battle over efforts to expand voting by mail, with the White House, Congress and local election officials feuding over whether to make it easier to cast ballots from home this year.
A June 3 House Judiciary subcommittee hearing on protecting the right to vote amid the pandemic illustrated the divide — and turned up some questionable claims.
Voting rights advocates on the left, including former Georgia lawmaker Stacey Abrams, argued that Americans need more access to voting by mail. Advocates said there has been scant voter fraud in the past, and polls show most Americans support voting by mail.
Conservative legal activists, including J. Christian Adams, said that voting by mail has been problematic. Adams, who served on President Donald Trump’s defunct voter integrity commission, is president and general counsel of the Public Interest Legal Foundation, which has filed lawsuits seeking to get jurisdictions to keep voter rolls up to date or to oppose expansions of voting by mail.
""We found numerous failures in election administration, and we know from federal data that voting by mail is the most vulnerable form of voting, where hundreds of thousands of ballots have been rejected for defects and millions more end up missing or in landfills,"" Adams testified. 
The mailed ballots rejected for defects — sometimes as part of safeguards against voter fraud — represent a small percentage of the votes cast over four general elections. And Adams' statement that millions of ballots end up ""missing or in landfills"" is misleading.
RELATED: How battleground states are preparing for the pandemic election’s massive increase in voting by mail
Why some ballots are not returned
Adams’ foundation released a two-page document  in April that included voting-by-mail statistics during the past four general elections, from 2012 to 2018. Using U.S. Election Assistance Commission survey data, the foundation said that about 146 million ballots were mailed out to voters. 
Of those, 28 million ballots were ""not returned by voter, spoiled, returned as undeliverable, or otherwise unable to be tracked."" The federal commission refers to these ballots as ""unknown,"" not ""missing.""
Those ballots ""represent 28 million opportunities for someone to cheat,"" Adams wrote. 
But experts say that’s a mischaracterization of what’s generally happening with these ballots. It’s more accurate to refer to them as uncast or unreturned. 
""The vast majority are sitting on kitchen counters or put in the trash or recycling because individuals who received them did not end up casting votes,"" said Barry Burden, a University of Wisconsin political scientist.
There are a few reasons why someone may receive an absentee ballot and then not use it. First, millions of these ballots are in the states of Colorado, Oregon and Washington that mail ballots to every active voter. Just as many voters don’t show up in person to vote, many voters in those states skip voting even when they are sent a ballot at home. For voters in other states, some were on ongoing lists to get absentee ballots for every election cycle, and may not have been engaged in a particular one. Even among voters who requested a ballot for that particular election, there are those who, for whatever reason, ultimately didn’t vote.
""Conflating voters choosing not to cast their ballot with ‘missing’ ballots is a fundamental flaw in the argument"" against voting by mail, wrote Vote at Home CEO Amber McReynolds, formerly Denver’s head of elections.

Featured Fact-check
















Facebook posts


stated on May 30, 2021 in a Facebook post








""Absent from the news — Dominion lost their lawsuits against Rudy Giuliani and Sidney Powell.""












By Tom Kertscher • June 1, 2021







Adams’ spokesman told us that the comments about landfills refers to a statement by Paul Gronke, a Reed College political science professor and director of the Early Voting Information Center.
""Election officials ‘know’ what happened to those ballots,"" Gronke told ProPublica. ""They were received by eligible citizens and not filled out. Where are they now? Most likely, in landfills."" 
Gronke told us that his words were being misinterpreted to suggest something nefarious. 
""These ballots were not returned,"" he said. ""They are not ‘missing.’ These are ballots that are not voted, and most likely, are simply discarded with the trash or paper recycling. That was the source of my somewhat tongue-in-cheek comment about a landfill.""
We sent Adams a summary of what experts said to dispute the characterization of these ballots as ""missing."" Adams defended his use of the word to describe ballots that are essentially unaccounted for.
""They are missing because nobody knows where they are,"" he said. ""They might be in landfills. They might be in the woods. They might be in a trunk.""
Ballots are rejected due to various errors
Adams’ group said that during the four most recent general elections, about 1.3 million ballots were rejected upon receipt out of about 146 million ballots, which works out to about 1 percent.
Federal data shows that rejected absentee ballots are a small subset. In 2016, about 1% of absentee ballots were rejected, most commonly for missing or mismatched signatures, or for arriving after the deadline. Signature checks are one of the ways election officials try to safeguard against absentee voter fraud, but they can also trip up voters who simply forgot to sign their ballots, or whose signatures have varied over time.
""If you talk to election officials, they’ll tell you that signature problems are almost all due to current signatures not matching what’s on file, not due to people fraudulently voting for others,"" MIT political science professor Charles Stewart said.
Rejected ballots can make a difference in an extremely close election, such as Minnesota’s 2008 U.S. Senate election between then incumbent Republican Norm Coleman and Democratic challenger Al Franken. The outcome of that election was tied up in eight months of litigation over absentee ballots that had been initially rejected because of errors by would-be voters hoping to participate in the election, said Ed Foley, an election law expert at Ohio State University.
""Obviously, that’s an unusual case, but it is one example (among others) that shows that absentee ballots are generally more vulnerable to disputation than in-person ballots,"" he said. 
Our ruling
Adams said in voting by mail ""hundreds of thousands of ballots have been rejected for defects and millions more end up missing or in landfills.""
Adams was referring to the outcome of mailed ballots during the past four general elections. Mail-in ballots rejected for defects represent  a very small share of the ballots issued, about 1 percent.
Adams’ claim that ""millions more end up missing or in a landfill"" is misleading in implying that they were mishandled. He is referring to ballots that were mailed to voters and then ultimately ended up in a category that the federal government calls ""unknown."" Election experts said it’s wrong to call these ballots missing — they represent voters who ultimately didn’t cast a ballot.
This claim has an element of truth, but leaves out important context that could give a different impression. We rate this claim Mostly False.",Protecting the Right to Vote During the COVID-19 Pandemic,https://judiciary.house.gov/calendar/eventsingle.aspx?EventID=2964,"Report: 28 Million Mail Ballots Went Missing in Past Decade,",https://publicinterestlegal.org/blog/report-28-million-mail-ballots-went-missing-in-past-decade/,"scant voter fraud in the past,",https://www.politifact.com/factchecks/2020/apr/09/donald-trump/donald-trumps-dubious-claim-thousands-are-conspiri/
1625024946-245,https://www.politifact.com/factchecks/list/?page=4&category=coronavirus&ruling=barely-true,"Gas is under $1 in 13 states, but $2.27 in Pennsylvania, because of the governor.","stated on May 2, 2020 in a Facebook post:",Facebook posts,"Gas is under $1 in 13 states, but $2.27 in Pennsylvania, because of the governor.",https://www.politifact.com/factchecks/2020/may/07/facebook-posts/cant-blame-governor-high-pennsylvania-gas-prices/,"Gas Prices




Transportation




Taxes




Facebook Fact-checks




Coronavirus




Pennsylvania







Facebook posts","Can’t blame governor for high Pennsylvania gas prices




If Your Time is short





A Facebook post blames Democratic Gov. Tom Wolf for high gasoline prices in Pennsylvania.


High gas taxes are one reason Pennsylvania’s gas prices are higher, but large increases result from a law that was adopted before he took office.





See the sources for this fact-check




Across the country, lower gasoline prices — dipping to below $1 per gallon, in some places — have been one byproduct of the COVID-19 outbreak.
Pennsylvania is the exception, according to a Facebook post that blames Democratic Gov. Tom Wolf. It says:
""Pennsylvania gasoline — $2.27/gallon. Ohio gasoline — 99 cents/gallon. Actually, 13 states under a dollar! Thanks Gov. Wolf!""
The post was flagged as part of Facebook’s efforts to combat false news and misinformation on its News Feed. (Read more about our partnership with Facebook.)
Even within a state, gas prices vary, of course. Leaving aside the precise cost of a gallon of regular unleaded on a given day, it’s fair to say that Pennsylvania’s gas prices are on the high end nationally. 
But gas taxes are only one reason gas prices vary among the states. And large gas tax hikes in Pennsylvania were done with a law that was enacted before Wolf was elected.
Pennsylvania gas prices higher
On May 2, the day of the Facebook post, the average price of regular gas in Pennsylvania was $2.03 per gallon, the American Automobile Association told PolitiFact. Forty states had averages of $1.99 or less.
That post was removed while we were preparing this fact-check. But the same image was posted by another Facebook user on May 4.)
On May 6, as we prepared this fact-check, the average price per gallon in Pennsylvania was $2.028 — ninth-highest in the country, according to AAA. Oklahoma was lowest, at $1.391.
In a comment to his post, the Facebook user cited an April 20 news article from a San Francisco TV station. That article cited a report three days earlier from GasBuddy.com, an app that tracks gas prices, that said gas prices were under $1 in 13 states:  Arkansas, Colorado, Iowa, Kansas, Kentucky, Michigan, Mississippi, Missouri, New York, Ohio, Oklahoma, Virginia and Wisconsin.
Pennsylvania gas taxes higher
Pennsylvania’s total gas tax (state plus federal) is 77.1 cents per gallon. That is second only to California’s 79 cents, as of Jan. 1, 2020, according to the American Petroleum Institute. (The federal tax alone is 18.4 cents per gallon.)
Pennsylvania’s gas tax is more than twice as high as the tax in three of the other 13 states cited in the Facebook post (Mississippi, Missouri and Oklahoma). Here are the total gas taxes in those 13 states, in cents per gallon:

Featured Fact-check
















Viral image


stated on June 1, 2021 in a Facebook post








“U.S. military arrests Dr. Deborah Birx.”












By Ciara O'Rourke • June 2, 2021







Arkansas (43.2), Colorado (40.4), Iowa (48.9), Kansas (42.43), Kentucky (44.4), Michigan (60.38), Mississippi (37.19), Missouri (35.82), New York (63.43), Ohio (56.91), Oklahoma (38.4), Virginia (40.35) and Wisconsin (51.3).
Why Pennsylvania gas costs more
Asked why Pennsylvania’s prices at the pump are higher than in the other 13 states, Patrick De Haan, head of petroleum analysis at GasBuddy, told PolitiFact it’s generally because of the state’s higher gas tax. But there are also regional factors, he said.
Distance from supply, supply disruptions, and retail competition and operating costs all play a role, according to the U.S. Energy Information Administration, a federal office.
Marc Stier, director of the nonprofit Pennsylvania Budget and Policy Center, noted that states such as Arizona, which has one of the lowest gas taxes, and Nevada, which is roughly in the middle, have higher gas prices than Pennsylvania.
As of May 6, according to AAA, the average price per gallon was less than 1 cent higher in Arizona than in Pennsylvania, but more than 30 cents higher in Nevada.
The governor’s role
When we asked Wolf’s office about the Facebook post, we were referred to the Pennsylvania Department of Revenue. A spokesman responded by citing a 2013 Pennsylvania law that raised money for transportation. 
That law was signed by Wolf’s predecessor, Republican Tom Corbett. It resulted in a series of increases in the state’s portion of the gas — from 32.3 cents per gallon to 58.7 cents. 
Stier said he is not aware of any attempts by Wolf, who took office in 2015, to reduce gas taxes. 
Wolf has defended the 2013 tax law as a mechanism to improve aging roads and bridges. In 2017, he and the Republican-controlled legislature allowed another increase from the 2013 law to take effect.
Our ruling
A Facebook post blamed Pennsylvania Gov. Tom Wolf for gas prices in Pennsylvania being higher than in 13 other states, where prices had dropped recently to lower than $1 per gallon in some places, while prices in Pennsylvania were above $2
A recent survey found gas prices under $1 in 13 states. 
Pennsylvania has the second-highest gas tax in the nation and gas taxes are a major reason why gas is more expensive in Pennsylvania.
But large increases in Pennsylvania’s gas tax took place under a law that was adopted before Wolf was elected. And there are other reasons — distance from supply, supply disruptions, and retail competition and operating costs — that cause gas prices to vary by region.
We rate the Facebook post Mostly False.",post,https://www.facebook.com/larry.zatko/posts/3163020783729957,post,https://www.facebook.com/photo.php?fbid=3295429297156536&set=basw.AbqM9I2Vmibhm4tJaH6VonBTC_olwKIclJv_a-EfQeEbSK0NYEiC2n5yjAnZ7Ss36JpgaCmuLxjmNNGk_li59AV18R5SyjyBzsppKcnQbUWKk9qmMiWVCelqHr2S0ay6FGDd5_u3xJFKMCC-s02XCUWhwUnU7CGQAqvXLqnWPL5lFQ.3295429297156536.2602422126705456.10213514866958565.465265457387728.10216005854433473.519450031969270&type=1&opaqueCursor=Abp3xEjo3DzrfmVq-8HAG8-UpQbOuCmu57RsZwVE09gYsfQCerJc--Ooiyi5K8IByLK227HeYwmCLKB-1_lPnq-d3ROFZxAJf9wTlC08E8D0S8Rd5BPP8H6_IbiGMQJGMnvPuGcKaGONoORZiLGT4qrgq5t-kCDrEHI3doU6ILfGkATtFGHrFWEvlD6F47QgqVCdazaAG6qNdqxL6ShsJa7yAKuaI_UwvJbFNinRj6MywTowk0MDD_HRxDoCruvUE0g-mWvEAk_fMiU55xH8iJEzoap28qYk3TidvJGUJPI4Ez62rUHXrMT7CL11Y-TgvUpJeMmfpZVPo64w3zbKH0_rc63XeVn2z4rKPjAjr-Hl4hAe3PUvQ3zWKd7WhRpoB7Tw6u4_xxFzCoFTEvXWw4vI3yMTO9Q0eJlZ1IuWySnhxBC24E1C4Sar5ZUT1LMkanjcfGfitk3e-2aEvJN0pwUn0uIRwQ9MTlE9-3_6Xrwc8qQDE_66qlf4_j7ok_BPdmJ5Ucj7oYrdFjyMzq0c19APef6Ax6Z3HPAUDc0zacO8XKlA533nE7PTypD9Y4MeY-fQe6Yns72Ow21_L3RUcRT_b8FAKLrusba4E_XxlXaKEw0bIiUp24qwh8wzSmi-Autyg-BxvB_REgmU6v-RD4-zbSc-c9YpLjroBA9o27jV8f6x7BPS0BEudcArYBSMJcrnP6gXIsDyIRS8BldZPqtHCwfRWVmj_sQvVyiay1oXiVwhKsU_PIF_mq-dwEn31Bpm1iKearskJZ-OgBngR8q7CKXPQQPrDQhM0KBNl_DSSqhtBFgQTKHSzBBFZSOlrmFLXSHueoV6SM4actPKcCFHTrXyY1gJquSrpvaFCaBAY_6fzSnoIwRa84IKrEv2Tcm5MWOVtGGI-YskhxCGFqkTUXJ_lCPG2rx37km_SCbLAis59Y5Jp_UvhH5LBzQ4mL525gfNYeTQ7ETxmiFfEgWrEbyxkQPkcTC1Hf6nhdPcTw&theater,null,
1625025091-256,https://www.politifact.com/factchecks/list/?page=3&category=coronavirus&ruling=barely-true,"Amid the COVID-19 outbreak, “Minnesota now has the highest unemployment rate in U.S. history.”","stated on May 6, 2020 in a Facebook post:",Facebook posts,"Amid the COVID-19 outbreak, “Minnesota now has the highest unemployment rate in U.S. history.”",https://www.politifact.com/factchecks/2020/may/26/facebook-posts/minnesota-doesnt-have-highest-unemployment-rate-us/,"Jobs




Facebook Fact-checks




Coronavirus







Facebook posts",,post,https://www.facebook.com/photo.php?fbid=10216631470762610&set=a.1264394333376&type=3&theater,null,,news release,https://mn.gov/deed/newscenter/press-releases/#/detail/appId/1/id/432987
