web-scraper-order,web-scraper-start-url,tiltle,date,Sourse,link,link-href,key_words,whole_text,first_source,first_source-href,second_sourse,second_sourse-href,third_source,third_source-href
1625024645-222,https://www.politifact.com/factchecks/list/?page=4&category=coronavirus&ruling=barely-true,"Says Nevada Gov. Steve Sisolak ""has banned the use of an anti-malaria drug that might help cure coronavirus.”","stated on March 25, 2020 in a Facebook post:",Turning Point USA,"Says Nevada Gov. Steve Sisolak ""has banned the use of an anti-malaria drug that might help cure coronavirus.”",https://www.politifact.com/factchecks/2020/mar/27/turning-point-usa/conservative-group-meme-distorts-nevadas-chloroqui/,"Public Health




PunditFact




Coronavirus







Turning Point USA","Conservative group's meme distorts Nevada’s chloroquine restrictions




If Your Time is short





A Nevada emergency regulation restricts the prescription of chloroquine for COVID-19 patients in outpatient settings, but not in hospitals and emergency rooms. 


Gov. Steve Sisolak signed the order on the recommendation of state health officials, who said there is the potential for stockpiling the drug.


Federal regulators say the effectiveness of chloroquine in treating COVID-19 is anecdotal, and more research and clinical trials are needed.





See the sources for this fact-check




A malaria drug that could potentially be used to treat COVID-19 has become the latest political touchpoint of the coronavirus pandemic.
A meme published on Facebook by Turning Point USA, a conservative group that targets high school and college students, claims Nevada Gov. Steve Sisolak bucked doctors’ recommendations and outlawed the use of chloroquine to treat the coronavirus.
""WHAT?! Nevada’s Leftist Governor Has Banned The Use Of An Anti-Malaria Drug That Might Help Cure Coronavirus!"" reads the caption on the meme, which was posted March 25, 2020. ""Big Government Is Deadly!""
This post was flagged as part of Facebook’s efforts to combat false news and misinformation on its News Feed. (Read more about our partnership with Facebook.) It has been shared more than 10,000 times.

(Screenshot from Facebook)
We’ve seen a lot of confusion about chloroquine, which is also prescribed to treat rheumatoid arthritis and lupus, and its application to COVID-19. So we wanted to check out Turning Point USA’s post.
While Sisolak has limited the prescription of chloroquine for coronavirus patients, the move isn’t a ban — and his order didn’t contradict doctors’ advice about the drug, as this post suggests. Health officials and federal regulators have urged caution when using the drug to treat COVID-19 until more research is done. The order is also intended to prevent hoarding, so patients who need the drug still have access to it. 
Regulation exempts hospitals, emergency rooms
Sisolak has restricted prescribing chloroquine for COVID-19. But the order has an exemption for doctors issuing the drug to patients in hospitals and emergency rooms.
On March 24, Sisolak, a Democrat, signed an emergency regulation that safeguards the supply of chloroquine and hydroxychloroquine, which is sold under the brand name Plaquenil and as a generic. The order prohibits doctors in outpatient settings from prescribing and dispensing the drugs for COVID-19 treatment. It also limits prescriptions to 30-day supplies.
""While the two drugs serve necessary medical purposes, there is no conclusive evidence at this time among COVID-19 experts or Nevada’s own medical health advisory team that the drugs provide treatment for COVID-19 patients,"" Sisolak said during a press conference. ""The emergency regulation is aimed at preventing the hoarding of the drugs so those that actually need them can have access to them.""
Sisolak’s order came after President Donald Trump touted the potential of chloroquine in treating COVID-19 patients during a March 19 press conference, saying it could be a ""game changer"" and a ""tremendous breakthrough.""
RELATED: Timeline: How Donald Trump responded to the coronavirus pandemic
News outlets first reported that Sisolak’s action was a ban on using chloroquine to treat COVID-19 patients. But that coverage missed a key fact: there is an exemption.
A spokesman for Sisolak told KSNV-TV in Las Vegas that the regulation allows for a ""chart order for an inpatient in an institutional setting,"" meaning that doctors in hospitals and emergency rooms can still prescribe chloroquine to treat patients diagnosed with COVID-19. The Associated Press, for one, corrected its initial story on the order to reflect that exemption.
So while Sisolak’s order does restrict the prescription of chloroquine in Nevada, it does not constitute an outright ban, as Turning Point USA’s meme claims.
Health officials pushed for chloroquine restrictions 
Nevada health officials advocated for restricting chloroquine prescriptions given the potential for hoarding. That’s different from Turning Point USA’s post, which makes it look like Sisolak disregarded physicians’ recommendations by issuing the emergency regulation.

Featured Fact-check
















Sherri Tenpenny


stated on June 8, 2021 in an Ohio House hearing








The COVID-19 vaccines make people ""magnetized. They can put a key on their forehead, it sticks. They can put spoons and forks all over them, and they can stick.""












By Bill McCarthy • June 9, 2021







In a March 20 letter, the state’s Board of Pharmacy noted that ""safety and efficacy have not been established"" for the use of hydroxychloroquine in treating COVID-19. Its guidance allowed for the use of chloroquine to treat coronavirus patients, but only as treatment — not prevention.
""In the effort to prevent the stockpiling of these medications, the Nevada State Board of Pharmacy is restricting the dispensing of chloroquine and hydroxychloroquine,"" wrote J. David Wuest, executive secretary of the board.
RELATED: Fact-checking COVID-19 prevention, treatment myths
As several news outlets have reported, physicians around the country have started to fraudulently prescribe themselves chloroquine in order to hoard it for their families. That hoarding has led to drug shortages in some parts of the country, affecting patients who take chloroquine regularly to treat conditions like lupus and arthritis.
Still, Sisolak’s order was quickly criticized by organizations like Turning Point USA and politicians like Sen. Ted Cruz, R-Texas, who tweeted March 25 that the governor was ""trying to score political points against Trump.""
Effectiveness against COVID-19 is unproven 
Turning Point USA’s meme makes it seem like chloroquine is a potential cure for the coronavirus. But the science is not settled.
Trump’s March 19 remarks on chloroquine were based on a recent French study that found the malaria drug could be effective in treating patients with COVID-19. The authors, which include researchers from universities in France and Vietnam, concluded that the use of chloroquine sped up healing, and the effect was reinforced by adding azithromycin, an antibiotic. 
But the study was based on only 20 people in France with COVID-19, and public health experts quickly put the findings into perspective.
On March 19, the Food and Drug Administration published a statement in which it said that while ""there are no FDA-approved therapeutics or drugs to treat, cure or prevent COVID-19,"" the agency is investigating whether chloroquine ""can be used to treat patients with mild-to-moderate COVID-19 to potentially reduce the duration of symptoms.""
During a press conference on March 20, Dr. Anthony Fauci, director of the National Institute of Allergy and Infectious Diseases, also tempered expectations for the malaria drug, saying the French study was based on anecdotal evidence.
RELATED: A 100% COVID-19 cure? No, chloroquine effectiveness only anecdotal
""The information that you're referring to specifically is anecdotal; it was not done in a controlled clinical trial,"" Fauci told a reporter. ""So you really can't make any definitive statement about it.""
Based on that limited data, chloroquine is recommended for treatment of hospitalized COVID-19 patients in several countries, according to the Centers for Disease Control and Prevention. The drug is ""currently under investigation in clinical trials.""
We reached out to Turning Point USA for a comment, but we haven’t heard back.
Our ruling
Turning Point USA said in a Facebook post that Sisolak banned the use of chloroquine for COVID-19 against doctors’ recommendations.
Nevada’s emergency regulation restricts the prescription of chloroquine for COVID-19 patients in outpatient settings, but not in hospitals and emergency rooms. Sisolak signed the order on the recommendation of state health officials, who said the safety and efficacy of chloroquine in treating the coronavirus is unproven, and there is a potential for stockpiling the drug.
While the Facebook post touts the potential of chloroquine in curing COVID-19, federal health officials and regulators have said that, as of now, the effectiveness of the drug is anecdotal. More research and clinical trials are needed before drawing a conclusion.
Turning Point USA’s post contains an element of truth but ignores critical facts that would give a different impression. We rate it Mostly False.",AP FACT CHECK: Trump's Breathless Takes on Drugs for Virus,https://www.nytimes.com/aponline/2020/03/21/us/politics/bc-us-fact-check-week.html,"Malaria Drugs' Promise for Coronavirus Spurs Hope, Shortages",https://www.nytimes.com/aponline/2020/03/23/health/bc-us-med-virus-outbreak-malaria-drug-evidence.html,Nevada governor bars gatherings of more than 10 people,https://apnews.com/72f591f9b46fd46c1bfb3b4b5cf9f1bb
1625025156-261,https://www.politifact.com/factchecks/list/?page=3&category=coronavirus&ruling=barely-true,"“For the World Health Organization, the international entity whose sole responsibility it is to alert the world of global pandemics like this, to miss this, is a huge problem.”","stated on May 5, 2020 in a radio interview:",Brian Fitzpatrick,"“For the World Health Organization, the international entity whose sole responsibility it is to alert the world of global pandemics like this, to miss this, is a huge problem.”",https://www.politifact.com/factchecks/2020/may/30/brian-fitzpatrick/no-world-health-organization-didnt-miss-coronaviru/,"National




Coronavirus




Pennsylvania







Brian Fitzpatrick","No, the World Health Organization didn't ‘miss’ the coronavirus pandemic




If Your Time is short




A Jan. 14 tweet saying that Chinese authorities found no clear evidence of human-to-human transmission of the coronavirus led a Pennsylvania congressman to accuse the World Health Organization of failing to alert people about the pandemic.

 
Later in January, the WHO announced that in fact there was evidence of human-to-human transmission of the coronavirus and declared the outbreak a “public health emergency of international concern. 

 
Experts say the WHO was slow to designate the coronavirus a pandemic and that the organization should have been more skeptical of information it received from China before it sent that tweet but that accusing the WHO of missing the pandemic altogether goes too far.




See the sources for this fact-check




Speaking on the ""Fox Across America"" radio show, U.S. Rep. Brian Fitzpatrick accused global health officials of failing earlier this year to warn the world about the coming coronavirus pandemic. 
""For the World Health Organization, the international entity whose sole responsibility it is to alert the world of global pandemics, to miss this, is a huge problem,"" Fitzpatrick, a Republican, told radio host Jimmy Failla. 
We wondered whether Fitzpatrick’s stinging criticism was fair and what exactly the WHO told the public about the coronavirus in the pandemic’s earliest days. 
Fitzpatrick was referring to a Jan. 14 tweet from the WHO, which stated that ""preliminary investigations conducted by the Chinese authorities have found no clear evidence of human-to-human transmission of the novel #coronavirus (2019-nCoV) identified in #Wuhan, #China.""
A timeline of events on the WHO’s website about its actions on Jan. 14 offers a different account of what the organization told the public that day, indicating deeper concern than what was reflected in the tweet.
The timeline states that on that date, a WHO official noted in a press briefing that there ""may have been"" limited human-to-human transmission of the coronavirus between family members and that there was ""a risk of a possible outbreak."" 
Nearly a week later, according to the timeline, WHO investigators visited Wuhan, the Chinese city where the virus originated, and learned that there was evidence of human-to-human transmission, a major development that contradicted the Chinese government claims cited in the organization’s Jan. 14 tweet. 
Another week after that, the WHO’s director-general declared the novel coronavirus outbreak a ""public health emergency of international concern,"" a rare designation meant to convey the extraordinary and serious nature of an unfolding health crisis. 
On March 11, the WHO gave the coronavirus another ominous designation – global pandemic. 
Will Kiley, a spokesman for Fitzpatrick, said the two-month delay between the Jan. 14 tweet and the pandemic declaration justifies the congressman’s criticism, especially given evidence the virus had spread beyond China as early as Jan. 20.  
The Jan. 14 tweet accurately reflects what Chinese officials told the WHO at the time – that there was no evidence of human-to-human transmission. But the group should have questioned the accuracy of China’s claim before issuing the tweet, said Amesh Adalja, a senior scholar at the Johns Hopkins Center for Health Security. He and other infectious-disease experts did. 

Featured Fact-check
















Facebook posts


stated on June 2, 2021 in a Facebook post








Emails show ""Fauci's fellow scientist could tell early on that the (coronavirus) looked manufactured.""












By Jon Greenberg • June 2, 2021







""We didn’t believe them,"" Adalja said. ""It was clear to many who looked at the data that this virus wasn’t containable.""
A PolitiFact story on the WHO’s response to the pandemic written after President Donald Trump announced the United States would halt its financial support for the group found no credible evidence of human-to-human transmission prior to mid-January. 
""There were questions, but no solid confirmation,"" Boston University global health researcher Davidson Hamer told PolitiFact in April. 
But by Jan. 20, there had already been 200 cases, three deaths and three countries impacted, Adalja noted in a Jan. 20 blog post on the coronavirus, citing a paper published a day earlier by the Center for Infectious Disease Research and Policy. It was not until Jan. 22 that the WHO acknowledged for the first time that there had been human-to-human transmission. 
Adalja added that the WHO was slow to declare the coronavirus a public health emergency of international concern, and very slow issuing the pandemic declaration. Still, he said, accusing the WHO of missing the pandemic altogether goes too far. 
""When it comes to these declarations, there’s a lot of politics and diplomacy at play,"" Adalja said. 
Michael LeVasseur, an epidemiologist at Drexel University, also said he does not think the WHO missed the pandemic. 
""I don’t think anything was missed,"" LeVasseur said. ""Missed implies that they weren’t involved very early on, which they were.""
Fitzpatrick also claimed that alerting the world to global pandemics is the WHO’s ""sole responsibility."" But the group actually has a much broader mission to promote public health in parts of the world with limited access to health care. 
Our ruling
During a conservative talk radio interview, Fitzpatrick accused the WHO of missing the pandemic, citing a Jan. 14 tweet in which the organization reported Chinese assurances that  there was no human-to-human transmission of the virus. 
Experts argue that the WHO was slow to acknowledge human-to-human transmission, declare the coronavirus a ""public health emergency of international concern,"" and label it a pandemic. 
But the agency was actively gathering and disseminating information about the virus in the weeks prior to the official pandemic declaration, and it’s possible to interpret public statements made during this time as cautious, not reckless. Saying the WHO missed the pandemic altogether goes too far. Also, Fitzpatrick’s claim doesn’t acknowledge the WHO’s work promoting public health.
For these reasons, we rate Fitzpatrick’s claim Mostly False.",tweet,https://twitter.com/who/status/1217043229427761152?lang=en,WHO Timeline - COVID-19,https://www.who.int/news-room/detail/27-04-2020-who-timeline---covid-19,"Mission summary: WHO Field Visit to Wuhan, China 20-21 January 2020",https://www.who.int/china/news/detail/22-01-2020-field-visit-wuhan-china-jan-2020
1625024598-219,https://www.politifact.com/factchecks/list/?page=4&category=coronavirus&ruling=barely-true,For coronavirus cases “in the U.S. 38% of those hospitalized are under 35.”,"stated on March 19, 2020 in a tweet:",Marco Rubio,For coronavirus cases “in the U.S. 38% of those hospitalized are under 35.”,https://www.politifact.com/factchecks/2020/mar/20/marco-rubio/young-people-are-being-hospitalized-covid-19-too-l/,"Coronavirus







Marco Rubio","Young people are being hospitalized for COVID-19, too. Let’s look at the numbers




If Your Time is short





Some college students on spring break have ignored the public health warnings to not congregate in large groups, but experts say young people are vulnerable to coronavirus, too.


The CDC reported that between mid-February and mid-March, 20% of the hospitalizations for coronavirus were for patients age 20-44 and 18% were age 45-54.


The CDC cautioned that the data is preliminary and limited.





See the sources for this fact-check




With plenty of college students congregating for spring break, Sen. Marco Rubio, R-Fla., warned on Twitter that coronavirus is not only afflicting the elderly.
""We only have 3 months of information on  #Covid_19,"" Rubio tweeted March 19 to his 4 million followers. ""We have created the perception that younger people have nothing to worry about. We now need to stop saying that. In the U.S. 38% of those hospitalized are under 35. In France half of those in the ICU are under 65.""
 
Rubio’s overall point that younger people are vulnerable has merit. But his U.S. number is wrong.
For the record, his numbers on France were correct. The head of France’s national health agency said March 15 that 50% of people in intensive care are under 60 or under age 65. But we wanted to focus on the U.S. numbers.
Experts warn that U.S. hospitalization data is preliminary, which means the numbers could change in the coming weeks as testing becomes more widespread.
Data shows younger people hospitalized, but older groups more frequently
One day before Rubio’s tweet, the CDC reported there were 508 patients known to have been hospitalized as a result of coronavirus. The hospitalizations represented 12% of U.S. cases between Feb. 12 and March 16.
The data did not include an age group breakdown specific to those under 35. What the CDC did report was that 20% of those hospitalized were ages 20-44, and 18% were 45-54. If we add up those two age groups, we get a total of 38%. We asked Rubio’s spokespersons if that was the 38% he was referencing, but we did not get a response.

Major news outlets including the New York Times and NPR used that 38% statistic to point out that younger populations are also vulnerable to coronavirus. That’s an important message amid spring break, as some college students have ignored the recommendations to avoid large gatherings and have poured onto beaches in Florida, leading many counties or cities to close beaches. 
The CDC data shows that the elderly have the highest fatality rate.

Featured Fact-check
















Viral image


stated on June 1, 2021 in a Facebook post








“U.S. military arrests Dr. Deborah Birx.”












By Ciara O'Rourke • June 2, 2021







The March 18 report by the CDC states that the figures are based on preliminary data and include several limitations, including that data on age and outcomes, including hospitalization, were missing for between 9% and 53% of the cases. Also, further follow-up is needed to determine the outcomes among active cases and data on other risk factors, including if patients had underlying health conditions.
""At the current point, the data is too fluid to have confidence in the accuracy of any statement regarding how COVID-19 affects different age groups,"" said Volker Mai, a University of Florida epidemiologist.
However, Mai said, it’s important to clear up any misperception that young people are immune from the disease. Younger populations are at risk of contracting COVID-19, especially young people with underlying conditions.
""Since we are just at the start of the epidemic here, we don’t have enough data to make strong conclusions about age-specific risk of serious illness and/or death in the U.S. yet,"" said Cindy Prins, a professor of epidemiology at the University of Florida, in an email.
The reason, Prins said, is a lack or lag in testing
Our ruling
Rubio tweeted ""in the U.S. 38% of those hospitalized are under 35.""
We could not find any current data that matches Rubio’s tweet. It is possible that he was citing widely reported data that included people up to age 54.
The CDC reported that 20% of the hospitalizations were ages 20-44 and 18% were 45-54. But the data is preliminary, so it’s challenging to draw conclusions at this stage about the ages of people hospitalized. 
Rubio’s office didn’t get back to us but we have to wonder if the mistake in his tweet amounted to a simple transcription error.
Rubio does have a point that younger people are vulnerable to coronavirus — it’s not only older people who have been hospitalized. But because the data point is wrong, we rate this statement Mostly False.",Tweet,https://twitter.com/marcorubio/status/1240682713817976833,"Severe Outcomes Among Patients with Coronavirus Disease 2019 (COVID-19) — United States, February 12–March 16, 2020",https://www.cdc.gov/mmwr/volumes/69/wr/mm6912e2.htm?s_cid=mm6912e2_w#F2_down,More than half of coronavirus cases in France under intensive care are below the age of 60,https://www.cnn.com/world/live-news/coronavirus-outbreak-03-16-20-intl-hnk/h_91b13ce4323d365087bad47c5c9a8c39
