web-scraper-order,web-scraper-start-url,tiltle,date,Sourse,link,link-href,key_words,whole_text,first_source,first_source-href,second_sourse,second_sourse-href,third_source,third_source-href
1625025000-249,https://www.politifact.com/factchecks/list/?page=3&category=coronavirus&ruling=barely-true,“The CDC has recommended mail in voting. That’s what this whole pandemic is about: the election!”,"stated on May 7, 2020 in a Facebook post:",Facebook posts,“The CDC has recommended mail in voting. That’s what this whole pandemic is about: the election!”,https://www.politifact.com/factchecks/2020/may/12/facebook-posts/mail-voting-amid-covid-19-among-options-recommende/,"Facebook Fact-checks




Coronavirus







Facebook posts","Mail-in voting amid COVID-19 is among the options recommended by CDC, but not the only one




If Your Time is short




The CDC recommended in March many ways voters could minimize contact with other people, including voting by mail.

 
The CDC also recommended ways that in-person voting sites could adjust to the pandemic, such as encouraging early voting, drive-up voting and voting at off-peak times.

 
Research shows that the virus’ genetic makeup precludes it from being man-made and, as such, there is no indication that the pandemic’s origin is in any way tied to American elections.




See the sources for this fact-check




The U.S. Centers for Disease Control and Prevention has encouraged voting by mail, but that doesn’t mean it ruled out in-person voting.
""The CDC has recommended mail in voting. That’s what this whole pandemic is about: the election!"" stated a May 7 Facebook post.
In March, the CDC posted recommendations for elections. At the time, many states were slated to have presidential primaries. Some were delayed amid concerns they could hasten transmission of the novel coronavirus, which spreads primarily from person to person through respiratory droplets expelled while breathing, speaking, coughing and sneezing.
The CDC’s recommendations listed voting by mail as one of multiple options. 
The CDC recommended that election officials ""encourage voters to use voting methods that minimize direct contact with other people and reduce crowd size at polling stations."" Those specific recommendations included encouraging ""mail-in methods of voting if allowed in the jurisdiction."" 
It also encouraged early voting, drive-up voting and voting at off-peak times. The CDC also recommended moving polling sites away from homes for senior citizens, sanitizing election equipment and encouraging social distancing at polling sites.
We contacted the CDC to see if there had been additional guidance since March and did not get a response.
It’s important to note that the CDC’s recommendations are intended as public health guidance; they aren’t equivalent to law. Generally, states set laws that outline their rules for voting by mail, early voting and Election Day voting. Local officials administer elections, which means the CDC can’t ban in-person voting.

Featured Fact-check
















Viral image


stated on June 1, 2021 in a Facebook post








“U.S. military arrests Dr. Deborah Birx.”












By Ciara O'Rourke • June 2, 2021







Just a handful of states hold only mail-in voting by law. In the other states, elections officials expect a massive increase in requests for absentee ballots, but they are still planning to provide in-person voting options. California Gov. Gavin Newsom ordered that all eligible voters receive absentee ballots, however there will be in-person voting sites as well.
RELATED: Donald Trump’s dubious claim that 'thousands' are conspiring on mail-ballot fraud
The Facebook post plays into a conspiracy that Democrats are overhyping the pandemic to expand mail-in voting and help their chances in November. But the pandemic’s origin is in no way tied to the American election.
The COVID-19 infection outbreak was first detected in China in late December and quickly spread internationally. The World Health Organization declared it a pandemic on March 11. Research shows that the genetic makeup of the virus precludes it from being man-made.
Our ruling
A Facebook post said ""The CDC has recommended mail in voting. That’s what this whole pandemic is about: the election!"" 
In March, the CDC issued multiple recommendations to reduce the chance that voters would interact with each other, including voting by mail. But the CDC also recommended other ways voters could cast ballots, including at early voting sites or at off-peak times on election day. It also recommended precinct-level strategies for in-person voting such as encouraging social distancing and sanitizing election equipment.
What’s more, there is no indication that the pandemic’s origin is tied to American elections.
We rate this statement Mostly False.",Facebook post,https://www.facebook.com/anne.jensen.54390876/posts/2946077082105752,Recommendations for Election Polling Locations,https://www.cdc.gov/coronavirus/2019-ncov/community/election-polling-locations.html,recommendations for elections,https://www.cdc.gov/coronavirus/2019-ncov/community/election-polling-locations.html
1625024675-224,https://www.politifact.com/factchecks/list/?page=4&category=coronavirus&ruling=barely-true,"“There was no effort” to get American experts into China after it announced the coronavirus, and “we had one person in-country (and Trump) pulled him out of the country.”","stated on March 27, 2020 in a virtual town hall on CNN:",Joe Biden,"“There was no effort” to get American experts into China after it announced the coronavirus, and “we had one person in-country (and Trump) pulled him out of the country.”",https://www.politifact.com/factchecks/2020/apr/03/joe-biden/whats-true-whats-not-bidens-attacks-trump-and-gett/,"National




China




Coronavirus







Joe Biden","What’s true, what’s not in Biden’s attacks on Trump and getting experts in China amid coronavirus




If Your Time is short





Top Health and Human Services officials offered to send American experts to China within a week after China revealed a new virus was on the loose.


China resisted American and World Health Organization teams, but eventually allowed a WHO team —that included some Americans — to enter the country.


CDC shrank its China office in 2019, largely driven by a reduction in efforts to control HIV/AIDS.





See the sources for this fact-check




Democratic presidential candidate Joe Biden has targeted what he sees as a couple of key failures by President Donald Trump that made the coronavirus crisis worse. In a CNN virtual town hall, Biden talked about the early days as the virus spread from China.
""I said, among others, that, you know, you should get into China, get our experts there, we have the best in the world, get them in so we know what's actually happening,"" Biden said March 27. ""There was no effort to do that. He didn't put any pressure on (Chinese President) Xi. I guess because of his trade deal, which wasn't much of a deal. And in addition to that, what happened was, we had one person in-country who was working. He pulled him out of the country.""
There are two claims to sort out: that Trump made no effort to get American epidemiologists into China, and that he pulled out the one person who was working there.
Biden’s first claim distorts the American response, and the second skips over other changes that took place at the same time. 
China resisted all outsiders
The words of Health and Human Services Secretary Alex Azar on Jan. 28 undercut Biden’s sweeping statement that ""there was no effort"" to get experts into China.
Azar said that by Jan. 6, about a week after China confirmed the existence of a new virus, ""we offered to send a CDC team to China.""
""I reiterated that offer when I spoke to China's Minister of Health on Monday (Jan. 27), and it was reiterated again via the World Health Organization today,"" Azar said. ""We are urging China: More cooperation and transparency are the most important steps you can take toward a more effective response.""
There is no question that China resisted the presence of outside experts.
The World Health Organization was working its own medical diplomacy to get more visibility into the China situation. Director-General Tedros Adhanom Ghebreyesus met with Xi on Jan. 28 in Beijing. That was a month into the pandemic and while he won approval for the deployment of a WHO team, that didn’t happen until Feb. 10.
The WHO group included some Americans, but in a statement, the Health and Human Services Departments said the Chinese ""limited the ability and timing for CDC staff to participate in the WHO joint mission.""
Biden’s campaign staff said that Trump himself should have pressed the issue in his conversations with Xi. We asked the White House press office if he had and got no comment. 

Featured Fact-check
















Facebook posts


stated on June 2, 2021 in a Facebook post








Emails show ""Fauci's fellow scientist could tell early on that the (coronavirus) looked manufactured.""












By Jon Greenberg • June 2, 2021







Regardless, Azar, a high-ranking member of the cabinet, did tell his Chinese counterpart that the United States was ready to provide people.  In a Jan. 27 tweet, Trump said he had broadly done the same.
""We have offered China and President Xi any help that is necessary. Our experts are extraordinary,"" Trump said.
Removing the one person in China
Biden said Trump pulled the ""one person"" in China ""who was working."" This, his staff said, referred to the July 2019 departure of an American epidemiologist from the CDC’s China office. (The CDC maintains offices in countries around the world. The one in China dates back to 2003.)
Reuters reported that the CDC epidemiologist, Linda Quick, would have been in a position to help Chinese experts respond to the emerging disease precisely because she was embedded in China’s CDC to train Chinese specialists.
The CDC’s website shows that the U.S. staff in China went from eight in March 2019 to three in December 2019. The change was driven by a shift in the U.S. strategy to combat HIV/AIDS, the U.S. Health and Human Services Department said.
""The President's Emergency Plan for AIDS Relief under the Office of Global AIDS Coordinator moved to a regional model in this region and based on the epidemic in China to date, changes were made to the existing footprint,"" the department’s statement said.
In July 2019, the CDC said it would complete its PEPFAR-funded work in China that year.
The department’s statement also said that CDC began ""scaling up"" before the outbreak. That didn’t necessarily mean additional U.S. staff. The program hires more Chinese staffers than American ones.
Our ruling
Biden said that Trump made ""no effort"" to get American experts into China and pulled the ""one person"" the U.S. had on the ground out of China.
Trump’s personal role is unclear, but his Health and Human Services secretary did make the effort to get U.S. experts inside. The department reached out to China in the first week of January, and secretary Azar asked his Chinese counterpart again in late January. China resisted outsiders, both from the U.S. and WHO. 
Biden’s assertion that Trump pulled the ""one person"" out of China has more substance, but is not as straight-forward as he made it sound. An American CDC epidemiologist left in July and was not replaced. The overall American staff went from eight down to three. According to the Health and Human Services Department, the staff reduction was mainly driven by changes in the U.S. strategy to reduce HIV/AIDS. Biden made it sound as though everyone left, but some CDC staff remained.
The first claim is, at best, exaggerated, and the second is murky on the details. We rate Biden’s attack Mostly False.",Joe Biden Town Hall,http://transcripts.cnn.com/TRANSCRIPTS/2003/27/se.01.html,Remarks at Coronavirus Press Briefing,https://www.hhs.gov/about/leadership/secretary/speeches/2020-speeches/remarks-at-coronavirus-press-briefing.html,Novel coronavirus press conference at United Nations of Geneva,https://www.who.int/docs/default-source/coronaviruse/transcripts/who-audio-script-ncov-rresser-unog-29jan2020.pdf?sfvrsn=a7158807_4
1625025385-279,https://www.politifact.com/factchecks/list/?page=2&category=coronavirus&ruling=barely-true,“Does the #DemConvention know @NYGovCuomo forced nursing homes across NY to take in COVID positive patients and planted the seeds of infection that killed thousands of grandmothers and grandfathers?”,"stated on August 17, 2020 in a tweet:",Michael Caputo,“Does the #DemConvention know @NYGovCuomo forced nursing homes across NY to take in COVID positive patients and planted the seeds of infection that killed thousands of grandmothers and grandfathers?”,https://www.politifact.com/factchecks/2020/aug/24/michael-caputo/hhs-official-blames-cuomo-nursing-home-covid-death/,"Corrections and Updates




Public Health




Health Check




New York




Coronavirus







Michael Caputo","Is Cuomo directive to blame for nursing home COVID deaths as HHS official claims?




If Your Time is short




New York Governor Andrew Cuomo has been dogged by criticism for months over his March advisory directing nursing homes in the state to accept patients who had or were suspected of having COVID-19.

 
In May, the governor amended the March order, prohibiting hospitals from discharging patients to nursing homes unless they tested negative for COVID-19.

 
The state health department issued a report in July that concluded the deadly coronavirus was introduced by nursing home staffers rather than sick patients.

 
Though some epidemiologists and nursing home advocates questioned the report’s methods and findings, public health experts agreed with the report’s conclusion — based on the timeline — that nursing home staffers and visitors, before they were banned, were likely the main drivers of COVID-19 infection and death in nursing homes.




See the sources for this fact-check




Editor’s note, Feb. 16, 2021: In recent weeks, N.Y. Gov. Andrew Cuomo has faced increasing scrutiny regarding his handling of information related to covid-related deaths among nursing home residents. A recent report by N.Y. Attorney General Letitia James noted that the death count may be 50% higher than what Cuomo’s administration provided. The attorney general’s estimate includes deaths that occurred after residents were transferred to the hospital, for example, a potential for undercounting that was mentioned in this fact check. The fact check itself focused on a policy issued by Cuomo in March directing nursing homes in the state to accept patients who had or were suspected of having covid-19. As long as they were medically stable, the notice said, it was appropriate to move patients in. Our ruling of Mostly False is unchanged by this new information. That rating was based on evidence that while the introduction of covid-19 positive patients into nursing homes no doubt had an effect on the spread of the coronavirus, Caputo’s statement suggested it was solely responsible. That’s not what the evidence showed, then or now.
On the first night of the Democratic National Convention, New York Gov. Andrew Cuomo was among the first in a weeklong parade of speakers to issue scathing critiques of the Trump administration’s coronavirus response.
Cuomo’s criticisms drew a quick reply in a tweet from Michael R. Caputo, an assistant secretary for public affairs at the Department of Health and Human Services.
""Does the #DemConvention know @NYGovCuomo forced nursing homes across NY to take in COVID positive patients and planted the seeds of infection that killed thousands of grandmothers and grandfathers?"" he wrote.

It was an easy jab: Cuomo has been dogged by criticism for months over his March advisory directing nursing homes in the state to accept patients who had or were suspected of having COVID-19. As long as they were medically stable, the notice said, it was appropriate to move patients in. Further, nursing homes were prohibited from requiring that medically stable prospective residents be tested for the virus before they arrived.
Between March 25 and May 8, approximately 6,326 COVID-positive patients were admitted to nursing homes, according to a state health department report.
While experts say this policy was flawed, is it fair to say that the governor’s directive ""forced"" nursing homes to take patients who were sick with COVID-19? And to what extent did that strategy sow the seeds of disease and death? When we examined the evidence, we found it was less clear cut than the statement makes it seem. The policy likely had an effect, but epidemiologists identified additional factors that fed the problem. What’s more the policy did not ""force"" nursing homes to accept COVID-positive patients. Nursing homes interpreted it this way. 
We checked with HHS to find the basis for Caputo’s comment but got no response.
The back story
As the virus tore through nursing homes, killing dozens at some of them, Cuomo came under withering censure. His administration’s policy, implemented with an eye toward freeing up hospital beds for an onslaught of COVID patients, seemed to disregard the risks to frail and elderly nursing home residents who were especially vulnerable to the disease.
According to the COVID Tracking Project, 6,624 people have died of COVID-19 in nursing homes and other long-term care facilities in New York, accounting for 26% of the state’s 25,275 COVID deaths. Some say the true number of deaths is much higher because, unlike many states, New York does not count the deaths of former nursing home residents who are transferred to hospitals and die there as nursing home deaths.
Cuomo’s explanation for the policy — that he was simply following guidance from the federal Centers for Disease Control and Prevention — didn’t cut it. A recent PolitiFact piece examining his claim rated it ""Mostly False.""
In May, the governor amended the March order, prohibiting hospitals from discharging patients to nursing homes unless they tested negative for COVID-19.
A misguided approach
In the early days of the COVID-19 pandemic, when New York was the epicenter and more than a thousand people were being hospitalized daily, there was genuine fear that hospitals would not be able to accommodate the influx of desperately ill patients.
Moving people out of the hospitals and into nursing homes was one strategy to help hospitals meet these needs.
According to the CDC guidance cited in the earlier PolitiFact story, there were two factors to consider when deciding whether to discharge a patient with COVID-19 to a long-term care facility: whether the patient was medically ready, and whether the facility could implement the recommended infection control procedures to safely care for a patient recovering from the virus.
A document from the federal Centers for Medicare & Medicaid Services said nursing homes should accept only patients they were able to care for.
Long-standing state guidance is based on the same condition.
Still, nursing homes didn’t believe turning away patients with COVID-19 was an option.
""On its face it looked like a requirement,"" said Christopher Laxton, executive director of the Society for Post-Acute and Long-Term Care Medicine, which represents medical professionals in nursing homes and other long-term care facilities. ""The nursing homes we spoke to felt it was a mandate, and a number of them felt they had no choice but to take COVID patients.""

Featured Fact-check
















Facebook posts


stated on June 2, 2021 in a Facebook post








“Fauci’s emails leaked.”












By Ciara O'Rourke • June 4, 2021







While the overarching guidance not to take patients in unless they could be safely cared for may have been clear, nursing homes’ experience was often different, said Richard Mollot, executive director of the Long-Term Care Community Coalition, an advocacy group for elderly and disabled people. ""There was little reason for nursing homes to think they should only take in patients if they have the ability to do so safely because those rules are not generally enforced on a regular basis.""
Bottom line: State and federal rules didn’t force nursing homes to accept COVID-positive patients, but many of them believed they had no other choice.
A lethal result?
How much of the blame for the deaths of thousands of people in nursing homes from COVID-19 can be attributed to Cuomo’s March advisory?
That is the 6,000-person question.
In a July analysis of COVID-19 nursing home deaths, the state concluded that the deadly virus was introduced by nursing home staff members rather than sick patients.
It noted that peak nursing home resident mortality from COVID-19 on April 8 preceded the peak influx of COVID patients on April 14. In addition, it found that nearly 1 in 4 nursing home workers — 37,500 people — were infected with the virus between March and early June.
Based on these and other factors, the report concluded that the state admissions policy could not have been a driver of nursing home infections or fatalities.
Epidemiologists and nursing home advocates beg to differ.
""To say that introducing patients [to nursing homes] who had COVID did not cause problems is ridiculous,"" said Laxton.
Calling the study’s approach ""pretty flawed,"" Denis Nash, an epidemiologist at City University of New York School of Public Health, said he didn’t agree with the report’s conclusion that the policy had nothing to do with deaths.
Others had the same view. ""I didn’t think they showed data to say [the policy] is not a ‘driver,’"" said Rupak Shivakoti, an assistant professor of epidemiology at the Mailman School of Public Health at Columbia University.
But Gary Holmes, assistant commissioner at the New York State Department of Health, had a different take. Critics of the report, he said, must be deliberately ignoring the rising death tolls in nursing homes in hot spots across the country.
""Public health officials in those states are experiencing (and acknowledging) what NY’s report indicated weeks ago: these facilities are microcosms of the community and transmission is occurring unknowingly by asymptomatic spread among staff members,"" Holmes said, in an email.
While public health experts quibbled with the report’s self-serving claim that the governor’s policy wasn’t a factor in COVID-19 nursing home deaths, they nevertheless agreed with the report’s broader conclusion that nursing home staffers as well as visitors, before they were banned, were likely the main drivers of COVID-19 infection and death in nursing homes.
""Based on the timeline of the policy and deaths in the city, it is very unlikely that policy contributed to thousands of deaths,"" said Shivakoti.
Infection control is a long-standing problem at nursing homes, Nash said, and the COVID deaths were a basic failure of infection control. That said, ""it’s unclear how many of the deaths the policy might have caused.""
Also unclear: how many of the dead were grandmothers and grandfathers.
Our ruling
In a tweet, the HHS assistant secretary for public affairs said that New York Gov. Andrew Cuomo ""forced"" nursing homes across the state to admit COVID-positive patients and that this policy fueled the spread of COVID-19 that led to thousands of deaths in the nursing home population.
Although nursing homes felt pressure to accept COVID-positive patients, they were not actually forced to do so. State regulations require nursing homes to accept patients only if they can care for them, and they could have refused them on those grounds.
In addition, it’s unclear the extent to which the governor’s policy was responsible for nursing home COVID-19 deaths. Infection control is a longstanding problem in nursing homes that predates the pandemic and a report showed peak numbers of nursing home deaths came prior to the peak influx of patients as a result of Cuomo’s advisory. While the introduction of COVID-19 positive patients into nursing homes no doubt had an effect on infection spread, Caputo’s statement suggests it was solely responsible. That’s not what the evidence shows.
We rate this Mostly False.",Advisory: Hospital Discharges and Admissions to Nursing Homes,https://skillednursingnews.com/wp-content/uploads/sites/4/2020/03/DOH_COVID19__NHAdmissionsReadmissions__032520_1585166684475_0.pdf,New York State Department of Health Issues Report on COVID-19 in Nursing Homes,https://www.health.ny.gov/press/releases/2020/2020-07-06_covid19_nursing_home_report.htm,tweet,https://twitter.com/MichaelRCaputo/status/1295537309786312705
