web-scraper-order,web-scraper-start-url,tiltle,date,Sourse,link,link-href,key_words,whole_text,first_source,first_source-href,second_sourse,second_sourse-href,third_source,third_source-href
1625024889-240,https://www.politifact.com/factchecks/list/?page=4&category=coronavirus&ruling=barely-true,Michigan Gov. Gretchen Whitmer “has just been stripped of her emergency coronavirus powers by her state legislature.”,"stated on April 27, 2020 in a screenshot:",Instagram posts,Michigan Gov. Gretchen Whitmer “has just been stripped of her emergency coronavirus powers by her state legislature.”,https://www.politifact.com/factchecks/2020/apr/29/instagram-posts/michigan-gov-whitmer-has-not-been-stripped-her-eme/,"Facebook Fact-checks




Coronavirus







Instagram posts","Michigan Gov. Whitmer said she would veto legislation to limit her emergency powers




If Your Time is short





Two bills passed in the Michigan Senate would limit the scope of Gov. Gretchen Whitmer’s authority to impose a state of emergency.


As of April 29, neither bill had passed the state House of Representatives. And the governor has said she will veto any legislation that restricts executive power during the coronavirus pandemic.


Whitmer’s stay-at-home order does not prohibit the sale of any particular product, as the Instagram post claims.





See the sources for this fact-check




Social media posts are targeting some state governors after they extended stay-at-home orders in response to the novel coronavirus.
An April 27 Instagram post includes a screenshot of a tweet that claims the Michigan Legislature stripped Gov. Gretchen Whitmer of her emergency powers because of the actions she’s taken against COVID-19. The tweet, which was posted April 26, links to a story from Neon Nettle, a website that has published misinformation in the past.
""Michigan's Democrat governor, Gretchen Whitmer, has just been stripped of her emergency coronavirus powers by her state legislature after she abused that power with insane orders such as blocking sales of vegetable seeds and American flags, etc.,"" the post reads.
The post was flagged as part of Facebook’s efforts to combat false news and misinformation on its News Feed. (Read more about our partnership with Facebook, which owns Instagram.) It has more than 4,700 likes.

(Screenshot from Instagram)
Whitmer has been the subject of several hoaxes about her handling of the coronavirus pandemic in Michigan, where thousands protested the governor’s stay-at-home orders in mid-April. So we wanted to check out this Instagram post, too.
Michigan’s Republican-controlled Legislature has moved to restrict Whitmer’s emergency powers. But the bills have only passed the Senate, and the governor has said she will veto any legislation that restricts executive power during the coronavirus crisis. Plus, Whitmer has not banned the sale of vegetables or American flags, as the post claims, though her orders have restricted the types of retail businesses and store departments that can stay open.

Featured Fact-check
















Viral image


stated on June 1, 2021 in a Facebook post








“U.S. military arrests Dr. Deborah Birx.”












By Ciara O'Rourke • June 2, 2021







Whitmer first declared a state of emergency March 10 and issued a stay-at-home order nearly two weeks later. On April 24, Whitmer signed an executive order to extend the stay-at-home restrictions through May 15, but loosened some provisions. 
Although the number of new COVID-19 cases has slightly decreased in Michigan, Whitmer’s aggressive actions against the coronavirus have attracted the ire of Republicans in her state and across the country who say they are unnecessarily strict and harm the economy. Ronna McDaniel, chair of the Republican National Committee, has said the governor is turning Michigan into a ""police state."" Several businesses and groups have filed lawsuits challenging the orders.
On April 16, Republicans in the state House of Representatives and Senate introduced bills that would repeal the 1945 Emergency Powers of the Governor Act, which gives the governor broad authority to declare a state of emergency in times of ""great public crisis."" Another pair of bills would amend the Emergency Management Act of 1976 to decrease the number of days the governor can declare an emergency from 28 to 14.
The Senate versions of both pieces of legislation passed in roll call votes April 24. But, as of April 29, they had not yet passed the House, which is also Republican-controlled. Whitmer has said she will veto the measures.
""Of course, I will veto bills that they send over to limit the executive power. I've been very clear about that from day one,"" she said April 23. ""Those blatant power grabs are bad in good times and dangerous in times of crisis.""
The Instagram post also errs in saying that Republicans targeted Whitmer’s emergency powers because she used them to issue orders ""blocking sales of vegetable seeds and American flags."" We rated two similar claims False — Whitmer’s executive orders do not ban the sale of any particular product.
Since Michigan legislators have moved to limit the governor’s emergency powers, the Instagram post contains an element of truth. But Whitmer’s emergency powers have not yet been repealed, and she has said she will veto the legislation if and when it reaches her desk.
We rate the post Mostly False.","Whitmer extends stay-home order through May 15, eases rules",https://apnews.com/e8563054ac982d4b557559b3c724c6b3,Michigan Legislature wants to create committee to oversee Whitmer's coronavirus response,https://www.freep.com/story/news/local/michigan/2020/04/23/michigan-coronavirus-whitmer-republicans/3012244001/,"Republicans introduce bills to strip power from Whitmer, but she promises a veto",https://www.freep.com/story/news/politics/2020/04/16/coronavirus-covid-19-gop-bills-strip-power-whitmer/5149465002/
1625025511-289,https://www.politifact.com/factchecks/list/?page=2&category=coronavirus&ruling=barely-true,“We saved 2 million people” from dying of COVID-19.,"stated on October 15, 2020 in a town hall on NBC News:",Donald Trump,“We saved 2 million people” from dying of COVID-19.,https://www.politifact.com/factchecks/2020/oct/21/donald-trump/trump-says-he-prevented-2-million-covid-19-deaths-/,"Public Health




Health Check




Coronavirus







Donald Trump","Trump says he prevented 2 million COVID-19 deaths. Where does he get that number?




If Your Time is short




President Donald Trump keeps saying his efforts to lock down the country and implement restrictions for those traveling from China saved 2 million lives.

 
The number is taken from a model that predicted how many people would die if no mitigation measures were put in place and people continued their lives normally. Experts said it is unlikely that Americans would have taken no steps to protect themselves.




See the sources for this fact-check




President Donald Trump has repeatedly claimed to have saved 2 million lives from COVID-19 through his actions to combat the disease.
He made the assertion again during the NBC News town hall on Oct. 15 that replaced the second presidential debate.
""But we were expected to lose, if you look at the original charts from original doctors who are respected by everybody, 2,200,000 people,"" Trump said. ""We saved 2 million people,"" he added.
He mentioned the same ballpark figure during a Sept. 15 ABC News town hall and posted a tweet about it on Oct. 13.
Others in the Trump administration have also pointed to the 2.2 million figure. Vice President Mike Pence referenced it during the vice presidential debate on Oct. 7. So did Health and Human Services Secretary Alex Azar during a Sept. 20 ""Meet the Press"" television interview.
Where did this number come from? And is there any truth to the idea that Trump is responsible for saving 2 million lives from COVID-19? Since Trump continues to use it to claim success, we decided to look into it.
What we know about the ‘2 million’
The White House and the Trump presidential campaign did not respond to our request for evidence supporting the idea that roughly 2 million lives were spared because of the administration's actions.
The figure appears to have been mentioned by the president first during a March 29 White House coronavirus task force press briefing, when Trump and Dr. Deborah Birx, task force coordinator, explained they were asking Americans to stay home from mid-March through the end of April, because mathematical models showed 1.6 million to 2.2 million people could die from COVID-19. 
The warning stemmed from a paper authored by Neil Ferguson, an epidemiology professor at Imperial College London. He modeled how COVID-19 can spread through a population in different scenarios, including what would happen if no interventions were put in place and people continued to live their daily lives as normal.
In the paper, Ferguson wrote, ""In total, in an unmitigated epidemic, we would predict approximately 510,000 deaths in [Great Britain] and 2.2 million in the US.""
Ferguson did not respond to our request to talk through the study with him. But in a July email interview with HuffPost, he said Trump’s boast of having saved 2 million lives isn’t true, because the pandemic isn’t over.
Andrea Bertozzi, a mathematics professor at UCLA, said it was important to remember the 2.2 million figure was derived from a modeling scenario that would almost certainly never happen — which is that neither the government nor individuals would change their behavior at all in light of COVID-19.
The study didn’t mean to say 2.2 million people were absolutely going to die, but rather to say, ""Hold on, if we let this thing run its course, bad things could happen,"" said Bertozzi. Indeed, the results from the study did cause government leaders in both the U.S. and the United Kingdom to implement social distancing measures.
Experts also pointed out that the U.S. has the highest COVID-19 death toll of any country in the world — more than 220,000 people — and among the highest death rates, according to the Johns Hopkins Coronavirus Resource Center.
""I don’t think we can say we’ve prevented 2 million deaths, because people are still dying,"" said Justin Lessler, an associate professor of epidemiology at Johns Hopkins Bloomberg School of Public Health.

Featured Fact-check
















Instagram posts


stated on June 2, 2021 in an Instagram post








An email from Dr. Anthony Fauci shows ""everyone was lied to"" about wearing masks to prevent the spread of COVID-19.












By Tom Kertscher • June 2, 2021







In some instances when using the 2 million estimate, Trump and others in his administration cited the China travel restrictions for saving lives, while other times they’ve credited locking down the economy. We’ll explore whether either statement holds water.
Did travel restrictions do anything?
Trump implemented travel restrictions for some people traveling from China beginning Feb. 2 and from Europe on March 11. But experts say and reports show the restrictions don’t appear to have had much effect because they were put in place too late and had too many holes.
The Centers for Disease Control and Prevention reported the first cases of coronavirus in the U.S. arrived in mid-January. So, since the travel bans were put in place after COVID-19 was already spreading in the U.S., they weren’t effective, said Josh Michaud, associate director for global health policy at the KFF. (KHN is an editorially independent program of KFF.)
A May study supports that assessment. The researchers found the risk of transmission from domestic air travel exceeded that of international travel in mid-March.
Many individuals also still traveled into the U.S. after the bans, according to separate investigations by The New York Times and the Associated Press.
Based on all this, experts said there isn’t evidence to support the idea that the travel restrictions were the principal intervention to reduce the transmission of COVID-19.
What about lockdowns?
On the other hand, the public health experts we talked to said multiple global and U.S.-focused studies show that lockdowns and implementing social distancing measures helped to contain the spread of the coronavirus and thus can be said to have prevented deaths.
However, Trump can’t take full credit for these so-called lockdown measures, which ranged from closing down all but essential businesses to implementing citywide curfews and statewide stay-at-home orders. On March 16, after being presented with the possibility of the national death tally rising to 2.2. million, the White House issued federal recommendations to limit activities that could transmit the COVID-19 virus. But these were just guidelines and were recommended to be in effect only through April 30.
Most credit for putting in place robust social distancing measures belongs to state and local government and public health officials, many of whom enacted stronger policies than those recommended by the White House, our experts said.
""I don’t think you can directly credit the federal government or the Trump administration with the shutdown orders,"" said Lessler. ""The way our system works is that the power for public health policy lies with the state. And each state was making its own individual decision.""
Some studies also explore the potential human costs of missed opportunities. If lockdowns had been implemented one or two weeks earlier than mid-March, for instance, which is when most of the U.S. started shutting down, researchers estimated that tens of thousands of American lives could have been saved. A model also shows that if almost everyone wore a mask in the U.S., tens of thousands of deaths from COVID-19 could have been prevented.  
Despite these scientific findings, Trump started encouraging states — even those with high transmission rates — to open back up in May, after the White House’s recommendations to slow the spread of COVID-19 expired. He has also questioned the efficacy of masks, said he wouldn’t issue a national mask mandate and instead left mask mandate decisions up to states and local jurisdictions. 
Our ruling
President Trump is claiming that if not for his efforts, there would have been 2 million more deaths in the U.S. from COVID-19.
But that 2 million number is taken from a model that shows what would happen without any mitigation measures — that is, if citizens had continued their daily lives as usual, and governments did nothing. Experts said that wouldn’t have happened in real life.
And while lockdowns and social distancing have indeed been proven to prevent COVID-19 illness and deaths, credit for that doesn’t go solely to Trump. The White House issued federal recommendations asking Americans to stay home, but much stronger social distancing measures were enforced by states.
Travel restrictions implemented by Trump perhaps helped hold down transmission in the context of broader efforts, but on their own, they don’t seem to have significantly reduced the transmission rate of the coronavirus.
We rate this claim Mostly False.","""Trump’s ABC News Town Hall: Full Transcript,""",https://abcnews.go.com/Politics/trumps-abc-news-town-hall-full-transcript/story?id=73035489,"""Trump’s Early Coronavirus Ban on Travelers From China Was Full of Holes,""",https://www.latimes.com/world-nation/story/2020-07-04/trumps-strong-wall-to-block-covid-19-from-china-had-holes,"""Coronavirus: Prof Neil Ferguson Quits Government Role After 'Undermining' Lockdown,""",https://www.bbc.com/news/uk-politics-52553229
1625024690-225,https://www.politifact.com/factchecks/list/?page=4&category=coronavirus&ruling=barely-true,"Says for otherwise healthy people “experiencing mild to moderate respiratory symptoms with or without a COVID-19 diagnosis … only high temperatures kill a virus, so let your fever run high,” but not over 103 or 104 degrees.","stated on March 28, 2020 in a Facebook post:",Facebook posts,"Says for otherwise healthy people “experiencing mild to moderate respiratory symptoms with or without a COVID-19 diagnosis … only high temperatures kill a virus, so let your fever run high,” but not over 103 or 104 degrees.",https://www.politifact.com/factchecks/2020/apr/03/facebook-posts/letting-fever-run-fight-coronavirus-could-be-risky/,"Public Health




Facebook Fact-checks




Coronavirus







Facebook posts",,post,https://www.facebook.com/jaimie.sweeten/posts/3175801195785781,"""Symptoms,""",http://symptoms/,"""Treatments for COVID-19,""",https://www.health.harvard.edu/diseases-and-conditions/treatments-for-covid-19
1625025996-335,https://www.politifact.com/factchecks/list/?page=1&category=coronavirus&ruling=barely-true,"“Now, 50% of all of America, more than any other country, is fully vaccinated.”","stated on May 27, 2021 in a speech in Cleveland:",Joe Biden,"“Now, 50% of all of America, more than any other country, is fully vaccinated.”",https://www.politifact.com/factchecks/2021/may/28/joe-biden/joe-biden-exaggerates-us-rank-world-coronavirus-va/,"Public Health




Coronavirus







Joe Biden","Joe Biden exaggerates U.S. rank in world coronavirus vaccinations




If Your Time is short



• The United States’ vaccination program is faring well by international standards, exceeding all but two advanced industrialized nations in the percentage of residents who are considered fully vaccinated.
• However, the percentage of Americans who are fully vaccinated is 40%, not 50%. 
• In addition, five other countries have higher rates for full vaccination than the United States does.



See the sources for this fact-check




During a speech in Cleveland, President Joe Biden earned applause with a line about how well the United States has been doing in vaccinating people against the coronavirus.
""We've created more places to get vaccinated …  and now, 50% of all of America — more than any other country — is fully vaccinated,"" Biden said in his May 27 speech.
The United States’ vaccination program is faring well by international standards, but Biden’s assertion is exaggerated on two counts — both on the percentage of Americans who are fully vaccinated, and on the United States’ international ranking. 
""50% of all of America ... is fully vaccinated""
Biden flubbed this talking point.
According to data for May 27 from the Centers for Disease Control and Prevention, 40% of the U.S. population is now fully vaccinated, not 50%.

Two other statistics do hover around 50%: Almost 50% of the population has received at least one dose, and slightly over 50% of all U.S. adults are fully vaccinated. (Americans younger than 12 cannot receive a vaccine yet, and the government only recently approved those between 12 and 15 to receive a vaccine. This explains why the adult vaccination figure is higher than it is for the overall population.)
But these statistics would not fit in this context, because Biden said ""all of America"" and ""fully vaccinated.""
The U.S. vaccination rate, ""50%"", is ""more than any other country""
The U.S. scores well on international vaccination percentages, but it is not No. 1 in the world.

Featured Fact-check
















Instagram posts


stated on June 2, 2021 in an Instagram post








An email from Dr. Anthony Fauci shows ""everyone was lied to"" about wearing masks to prevent the spread of COVID-19.












By Tom Kertscher • June 2, 2021







According to statistics compiled by Our World in Data, five countries had higher full-vaccination rates than the U.S. on May 27.  Three are small and aren’t really comparable to the U.S. — Aruba, Bahrain, and Curacao — but two are developed, industrialized nations, Israel and Chile.

 
On Biden’s broader point, the U.S. does have a higher full-vaccination rate than all members of the Organization for Economic Cooperation and Development — a group of higher-income nations that is often used as a proxy for major nations — except for Israel and Chile.

 
The White House’s response
The White House told PolitiFact that in raw numbers of vaccinated individuals, the U.S. does rank No. 1. That number is backed up by Our World in Data, which reported that on May 27, the U.S. had administered 165.72 million shots, which surpasses second-place India, which had given 158.78 million shots.
However, in his statement in Cleveland, Biden explicitly referred to a percentage, not a raw number, and he specifically said ""fully vaccinated,"" which is a different measurement than the simple number of shots administered.
Our ruling
Biden said, ""Now, 50% of all of America — more than any other country — is fully vaccinated.""
The United States’ vaccination program is faring well by international standards, exceeding all but two advanced industrialized nations in the percentage of residents who are considered fully vaccinated.
But Biden has exaggerated on two counts. The percentage of Americans who are fully vaccinated is 40%, not 50%. And five other countries have higher rates for full vaccination than the United States does.
We rate the statement Mostly False.",Cleveland speech transcript,https://www.rev.com/transcript-editor/shared/Kcpycy46mVp28Fukf5gIPXSptTEh7y7P4OlbythyPbyUJTjT8pNry9qPLESQb_fOmyXYl6wJy7R5tKXgRDDk7-yo7RU?loadFrom=PastedDeeplink&ts=779.62,COVID-19 Vaccinations in the United States,https://covid.cdc.gov/covid-data-tracker/#vaccinations,Coronavirus (COVID-19) Vaccinations,https://ourworldindata.org/covid-vaccinations
